type	value	display_name	definition	wiki_url
RESO::ConstructionMaterial	Unknown	Unknown	The structure was made wholly or partly with unknown.	https://ddwiki.reso.org/display/DDW17/Unknown
RESO::ConstructionMaterial	VerticalSiding	Vertical Siding	The structure was made wholly or partly with vertical siding.	https://ddwiki.reso.org/display/DDW17/Vertical+Siding
RESO::ConstructionMaterial	VinylSiding	Vinyl Siding	The structure was made wholly or partly with vinyl siding.	https://ddwiki.reso.org/display/DDW17/Vinyl+Siding
RESO::ConstructionMaterial	WoodSiding	Wood Siding	The structure was made wholly or partly with wood siding.	https://ddwiki.reso.org/display/DDW17/Wood+Siding
RESO::ContactListingPreference	Discard	Discard	The contact has flagged to discard the given listing. The contact is not interested in the given listing.	https://ddwiki.reso.org/display/DDW17/Discard
RESO::ContactListingPreference	Favorite	Favorite	The contact has flagged the given listing as a favorite. The contact is interested in the given listing.	https://ddwiki.reso.org/display/DDW17/Favorite
RESO::ContactListingPreference	Possibility	Possibility	The contact has flagged the given listing as a possibility. The contact might be interested in the given listing.	https://ddwiki.reso.org/display/DDW17/Possibility
RESO::ContactStatus	Active	Active	The contact is active.	https://ddwiki.reso.org/pages/viewpage.action?pageId=29244403
RESO::ContactStatus	Deleted	Deleted	The contact has been deleted.	https://ddwiki.reso.org/pages/viewpage.action?pageId=29244404
RESO::ContactStatus	Inactive	Inactive	The contact is no longer active.	https://ddwiki.reso.org/pages/viewpage.action?pageId=29244405
RESO::ContactStatus	OnVacation	On Vacation	The contact is on vacation.	https://ddwiki.reso.org/display/DDW17/On+Vacation
RESO::ContactType	Business	Business	The contact is a business relation.	https://ddwiki.reso.org/display/DDW17/Business
RESO::ContactType	Family	Family	The contact is a family member.	https://ddwiki.reso.org/display/DDW17/Family
RESO::ContactType	Friend	Friend	The contact is a personal friend.	https://ddwiki.reso.org/display/DDW17/Friend
RESO::ContactType	Lead	Lead	The lead is a contact that may be a potential buyer or seller to the member.	https://ddwiki.reso.org/display/DDW17/Lead
RESO::ContactType	Prospect	Prospect	The contact is a prospective client.	https://ddwiki.reso.org/display/DDW17/Prospect
RESO::ContactType	ReadyToBuy	Ready to Buy	The contact is a client who is ready to start a transaction.	https://ddwiki.reso.org/display/DDW17/Ready+to+Buy
RESO::Cooling	AtticFan	Attic Fan	The property has an attic fan.	https://ddwiki.reso.org/display/DDW17/Attic+Fan
RESO::Cooling	CeilingFans	Ceiling Fan(s)	The property has one or more ceiling fans.	https://ddwiki.reso.org/pages/viewpage.action?pageId=29244511
RESO::Cooling	CentralAir	Central Air	The property has central air conditioning.	https://ddwiki.reso.org/display/DDW17/Central+Air
RESO::Cooling	Dual	Dual	The cooling system has two units.	https://ddwiki.reso.org/display/DDW17/Dual
RESO::Cooling	Ductless	Ductless	The cooling system does not ducted nor a wall/window type unit.  A mini-split is a common type of ductless system where an outdoor condenser is connected to an indoor fan unit that feeds the room in which it's located, rather than being ducted throughout the structure.	https://ddwiki.reso.org/display/DDW17/Ductless
RESO::Cooling	Electric	Electric	The cooling system is powered by electricity.	https://ddwiki.reso.org/pages/viewpage.action?pageId=29244515
RESO::Cooling	EnergyStarQualifiedEquipment	ENERGY STAR Qualified Equipment	The cooling system is ENERGY STAR Qualified.	https://ddwiki.reso.org/display/DDW17/ENERGY+STAR+Qualified+Equipment
RESO::Cooling	EvaporativeCooling	Evaporative Cooling	The cooling system works by way of water evaporation rather than a compressor and coolant.  Evaporative cooling systems are often referred to as swamp coolers.	https://ddwiki.reso.org/display/DDW17/Evaporative+Cooling
RESO::Cooling	ExhaustFan	Exhaust Fan	The structure has an exhaust fan.	https://ddwiki.reso.org/pages/viewpage.action?pageId=29244518
RESO::Cooling	Gas	Gas	The cooling system is powered by gas.	https://ddwiki.reso.org/pages/viewpage.action?pageId=29244519
RESO::Cooling	Geothermal	Geothermal	The cooling system runs on a geothermal source.	https://ddwiki.reso.org/display/DDW17/Geothermal
RESO::Cooling	HeatPump	Heat Pump	A system that exchanges heat between a warm and cool space.  The heat exchange is done between the dwelling and another air space, like outdoors; or a water source; or below ground (geothermal).	https://ddwiki.reso.org/display/DDW17/Heat+Pump
RESO::Cooling	HumidityControl	Humidity Control	The cooling system includes humidity control.	https://ddwiki.reso.org/display/DDW17/Humidity+Control
RESO::Cooling	MultiUnits	Multi Units	The cooing system includes more than one unit.	https://ddwiki.reso.org/display/DDW17/Multi+Units
RESO::Cooling	None	None	The property includes no cooling system.	https://ddwiki.reso.org/pages/viewpage.action?pageId=29244524
RESO::Cooling	Other	Other	The cooling system is different, or has features, that are not included in this list.	https://ddwiki.reso.org/pages/viewpage.action?pageId=29244525
RESO::Cooling	RoofTurbines	Roof Turbine(s)	The cooling utilizes a roof turbine.	https://ddwiki.reso.org/pages/viewpage.action?pageId=29244526
RESO::Cooling	SeparateMeters	Separate Meters	The cooling system has separate meters for its multiple units/zones.	https://ddwiki.reso.org/display/DDW17/Separate+Meters
RESO::Cooling	VariesByUnit	Varies by Unit	The cooling equipment varies by unit.	https://ddwiki.reso.org/pages/viewpage.action?pageId=29244528
RESO::Cooling	WallUnits	Wall Unit(s)	The cooling system is stand alone and mounted in an opening in an outer wall.	https://ddwiki.reso.org/pages/viewpage.action?pageId=29244530
RESO::Cooling	WallWindowUnits	Wall/Window Unit(s)	The cooling system is mounted in an opening in the wall or in a window.	https://ddwiki.reso.org/pages/viewpage.action?pageId=29244529
RESO::Cooling	WholeHouseFan	Whole House Fan	The property has a whole house fan.	https://ddwiki.reso.org/display/DDW17/Whole+House+Fan
RESO::Cooling	WindowUnits	Window Unit(s)	The cooling system is window mounted.	https://ddwiki.reso.org/pages/viewpage.action?pageId=29244532
RESO::Cooling	Zoned	Zoned	The cooling system has more than one zone.	https://ddwiki.reso.org/display/DDW17/Zoned
RESO::Country	AD	AD	Andorra is the country in which the individual, entity or property is located. The two letter code is based on ISO standard 3166.	https://ddwiki.reso.org/display/DDW17/AD
RESO::Country	AE	AE	United Arab Emirates is the country in which the individual, entity or property is located. The two letter code is based on ISO standard 3166.	https://ddwiki.reso.org/display/DDW17/AE
RESO::Country	AF	AF	Afghanistan is the country in which the individual, entity or property is located. The two letter code is based on ISO standard 3166.	https://ddwiki.reso.org/display/DDW17/AF
RESO::Country	AG	AG	Antigua Barbuda is the country in which the individual, entity or property is located. The two letter code is based on ISO standard 3166.	https://ddwiki.reso.org/display/DDW17/AG
RESO::Country	AI	AI	Anguilla is the country in which the individual, entity or property is located. The two letter code is based on ISO standard 3166.	https://ddwiki.reso.org/display/DDW17/AI
RESO::Country	AL	AL	Albania is the country in which the individual, entity or property is located. The two letter code is based on ISO standard 3166.	https://ddwiki.reso.org/display/DDW17/AL
RESO::Country	AM	AM	Armenia is the country in which the individual, entity or property is located. The two letter code is based on ISO standard 3166.	https://ddwiki.reso.org/display/DDW17/AM
RESO::Country	AN	AN	Netherlands Antilles is the country in which the individual, entity or property is located. The two letter code is based on ISO standard 3166.	https://ddwiki.reso.org/display/DDW17/AN
RESO::Country	AO	AO	Angola is the country in which the individual, entity or property is located. The two letter code is based on ISO standard 3166.	https://ddwiki.reso.org/display/DDW17/AO
RESO::Country	AQ	AQ	Antarctica is the country in which the individual, entity or property is located. The two letter code is based on ISO standard 3166.	https://ddwiki.reso.org/display/DDW17/AQ
RESO::Country	AR	AR	Argentina is the country in which the individual, entity or property is located. The two letter code is based on ISO standard 3166.	https://ddwiki.reso.org/display/DDW17/AR
RESO::Country	AS	AS	American Samoa is the country in which the individual, entity or property is located. The two letter code is based on ISO standard 3166.	https://ddwiki.reso.org/display/DDW17/AS
RESO::Country	AT	AT	Austria is the country in which the individual, entity or property is located. The two letter code is based on ISO standard 3166.	https://ddwiki.reso.org/display/DDW17/AT
RESO::Country	AU	AU	Australia is the country in which the individual, entity or property is located. The two letter code is based on ISO standard 3166.	https://ddwiki.reso.org/display/DDW17/AU
RESO::Country	AW	AW	Aruba is the country in which the individual, entity or property is located. The two letter code is based on ISO standard 3166.	https://ddwiki.reso.org/display/DDW17/AW
RESO::Country	AX	AX	Land Islands is the country in which the individual, entity or property is located. The two letter code is based on ISO standard 3166.	https://ddwiki.reso.org/display/DDW17/AX
RESO::Country	AZ	AZ	Azerbaijan is the country in which the individual, entity or property is located. The two letter code is based on ISO standard 3166.	https://ddwiki.reso.org/display/DDW17/AZ
RESO::Country	BA	BA	Bosnia Herzegovina is the country in which the individual, entity or property is located. The two letter code is based on ISO standard 3166.	https://ddwiki.reso.org/display/DDW17/BA
RESO::Country	BB	BB	Barbados is the country in which the individual, entity or property is located. The two letter code is based on ISO standard 3166.	https://ddwiki.reso.org/display/DDW17/BB
RESO::Country	BD	BD	Bangladesh is the country in which the individual, entity or property is located. The two letter code is based on ISO standard 3166.	https://ddwiki.reso.org/display/DDW17/BD
RESO::Country	BE	BE	Belgium is the country in which the individual, entity or property is located. The two letter code is based on ISO standard 3166.	https://ddwiki.reso.org/display/DDW17/BE
RESO::Country	BF	BF	Burkina Faso is the country in which the individual, entity or property is located. The two letter code is based on ISO standard 3166.	https://ddwiki.reso.org/display/DDW17/BF
RESO::Country	BG	BG	Bulgaria is the country in which the individual, entity or property is located. The two letter code is based on ISO standard 3166.	https://ddwiki.reso.org/display/DDW17/BG
RESO::Country	BH	BH	Bahrain is the country in which the individual, entity or property is located. The two letter code is based on ISO standard 3166.	https://ddwiki.reso.org/display/DDW17/BH
RESO::Country	BI	BI	Burundi is the country in which the individual, entity or property is located. The two letter code is based on ISO standard 3166.	https://ddwiki.reso.org/display/DDW17/BI
RESO::Country	BJ	BJ	Benin is the country in which the individual, entity or property is located. The two letter code is based on ISO standard 3166.	https://ddwiki.reso.org/display/DDW17/BJ
RESO::Country	BL	BL	Saint Barthelemy is the country in which the individual, entity or property is located. The two letter code is based on ISO standard 3166.	https://ddwiki.reso.org/display/DDW17/BL
RESO::Country	BM	BM	Bermuda is the country in which the individual, entity or property is located. The two letter code is based on ISO standard 3166.	https://ddwiki.reso.org/display/DDW17/BM
RESO::Country	BN	BN	Brunei Darussalam is the country in which the individual, entity or property is located. The two letter code is based on ISO standard 3166.	https://ddwiki.reso.org/display/DDW17/BN
RESO::Country	BO	BO	Bolivia is the country in which the individual, entity or property is located. The two letter code is based on ISO standard 3166.	https://ddwiki.reso.org/display/DDW17/BO
RESO::Country	BR	BR	Brazil is the country in which the individual, entity or property is located. The two letter code is based on ISO standard 3166.	https://ddwiki.reso.org/display/DDW17/BR
RESO::Country	BS	BS	Bahamas is the country in which the individual, entity or property is located. The two letter code is based on ISO standard 3166.	https://ddwiki.reso.org/display/DDW17/BS
RESO::Country	BT	BT	Bhutan is the country in which the individual, entity or property is located. The two letter code is based on ISO standard 3166.	https://ddwiki.reso.org/display/DDW17/BT
RESO::Country	BV	BV	Bouvet Island is the country in which the individual, entity or property is located. The two letter code is based on ISO standard 3166.	https://ddwiki.reso.org/display/DDW17/BV
RESO::Country	BW	BW	Botswana is the country in which the individual, entity or property is located. The two letter code is based on ISO standard 3166.	https://ddwiki.reso.org/display/DDW17/BW
RESO::Country	BY	BY	Belarus is the country in which the individual, entity or property is located. The two letter code is based on ISO standard 3166.	https://ddwiki.reso.org/display/DDW17/BY
RESO::Country	BZ	BZ	Belize is the country in which the individual, entity or property is located. The two letter code is based on ISO standard 3166.	https://ddwiki.reso.org/display/DDW17/BZ
RESO::Country	CA	CA	Canada is the country in which the individual, entity or property is located. The two letter code is based on ISO standard 3166.	https://ddwiki.reso.org/display/DDW17/CA
RESO::Country	CC	CC	Cocos (Keeling) Islands is the country in which the individual, entity or property is located. The two letter code is based on ISO standard 3166.	https://ddwiki.reso.org/display/DDW17/CC
RESO::Country	CD	CD	Congo Democratic Republic is the country in which the individual, entity or property is located. The two letter code is based on ISO standard 3166.	https://ddwiki.reso.org/display/DDW17/CD
RESO::Country	CF	CF	Central African Republic is the country in which the individual, entity or property is located. The two letter code is based on ISO standard 3166.	https://ddwiki.reso.org/display/DDW17/CF
RESO::Country	CG	CG	Congo is the country in which the individual, entity or property is located. The two letter code is based on ISO standard 3166.	https://ddwiki.reso.org/display/DDW17/CG
RESO::Country	CH	CH	Switzerland is the country in which the individual, entity or property is located. The two letter code is based on ISO standard 3166.	https://ddwiki.reso.org/display/DDW17/CH
RESO::Country	CI	CI	Cote d'Ivoire is the country in which the individual, entity or property is located. The two letter code is based on ISO standard 3166.	https://ddwiki.reso.org/display/DDW17/CI
RESO::Country	CK	CK	Cook Islands is the country in which the individual, entity or property is located. The two letter code is based on ISO standard 3166.	https://ddwiki.reso.org/display/DDW17/CK
RESO::Country	CL	CL	Chile is the country in which the individual, entity or property is located. The two letter code is based on ISO standard 3166.	https://ddwiki.reso.org/display/DDW17/CL
RESO::Country	CM	CM	Cameroon is the country in which the individual, entity or property is located. The two letter code is based on ISO standard 3166.	https://ddwiki.reso.org/display/DDW17/CM
RESO::Country	CN	CN	China is the country in which the individual, entity or property is located. The two letter code is based on ISO standard 3166.	https://ddwiki.reso.org/display/DDW17/CN
RESO::Country	CO	CO	Colombia is the country in which the individual, entity or property is located. The two letter code is based on ISO standard 3166.	https://ddwiki.reso.org/display/DDW17/CO
RESO::Country	CR	CR	Costa Rica is the country in which the individual, entity or property is located. The two letter code is based on ISO standard 3166.	https://ddwiki.reso.org/display/DDW17/CR
RESO::Country	CU	CU	Cuba is the country in which the individual, entity or property is located. The two letter code is based on ISO standard 3166.	https://ddwiki.reso.org/display/DDW17/CU
RESO::Country	CV	CV	Cabo Verde is the country in which the individual, entity or property is located. The two letter code is based on ISO standard 3166.	https://ddwiki.reso.org/display/DDW17/CV
RESO::Country	CX	CX	Christmas Island is the country in which the individual, entity or property is located. The two letter code is based on ISO standard 3166.	https://ddwiki.reso.org/display/DDW17/CX
RESO::Country	CY	CY	Cyprus is the country in which the individual, entity or property is located. The two letter code is based on ISO standard 3166.	https://ddwiki.reso.org/display/DDW17/CY
RESO::Country	CZ	CZ	Czech Republic is the country in which the individual, entity or property is located. The two letter code is based on ISO standard 3166.	https://ddwiki.reso.org/display/DDW17/CZ
RESO::Country	DE	DE	Germany is the country in which the individual, entity or property is located. The two letter code is based on ISO standard 3166.	https://ddwiki.reso.org/display/DDW17/DE
RESO::Country	DJ	DJ	Djibouti is the country in which the individual, entity or property is located. The two letter code is based on ISO standard 3166.	https://ddwiki.reso.org/display/DDW17/DJ
RESO::Country	DK	DK	Denmark is the country in which the individual, entity or property is located. The two letter code is based on ISO standard 3166.	https://ddwiki.reso.org/display/DDW17/DK
RESO::Country	DM	DM	Dominica is the country in which the individual, entity or property is located. The two letter code is based on ISO standard 3166.	https://ddwiki.reso.org/display/DDW17/DM
RESO::Country	DO	DO	Dominican Republic is the country in which the individual, entity or property is located. The two letter code is based on ISO standard 3166.	https://ddwiki.reso.org/display/DDW17/DO
RESO::Country	DZ	DZ	Algeria is the country in which the individual, entity or property is located. The two letter code is based on ISO standard 3166.	https://ddwiki.reso.org/display/DDW17/DZ
RESO::Country	EC	EC	Ecuador is the country in which the individual, entity or property is located. The two letter code is based on ISO standard 3166.	https://ddwiki.reso.org/display/DDW17/EC
RESO::Country	EE	EE	Estonia is the country in which the individual, entity or property is located. The two letter code is based on ISO standard 3166.	https://ddwiki.reso.org/display/DDW17/EE
RESO::Country	EG	EG	Egypt is the country in which the individual, entity or property is located. The two letter code is based on ISO standard 3166.	https://ddwiki.reso.org/display/DDW17/EG
RESO::Country	EH	EH	Western Sahara is the country in which the individual, entity or property is located. The two letter code is based on ISO standard 3166.	https://ddwiki.reso.org/display/DDW17/EH
RESO::Country	ER	ER	Eritrea is the country in which the individual, entity or property is located. The two letter code is based on ISO standard 3166.	https://ddwiki.reso.org/display/DDW17/ER
RESO::Country	ES	ES	Spain is the country in which the individual, entity or property is located. The two letter code is based on ISO standard 3166.	https://ddwiki.reso.org/display/DDW17/ES
RESO::Country	ET	ET	Ethiopia is the country in which the individual, entity or property is located. The two letter code is based on ISO standard 3166.	https://ddwiki.reso.org/display/DDW17/ET
RESO::Country	FI	FI	Finland is the country in which the individual, entity or property is located. The two letter code is based on ISO standard 3166.	https://ddwiki.reso.org/display/DDW17/FI
RESO::Country	FJ	FJ	Fiji is the country in which the individual, entity or property is located. The two letter code is based on ISO standard 3166.	https://ddwiki.reso.org/display/DDW17/FJ
RESO::Country	FK	FK	Falkland Islands is the country in which the individual, entity or property is located. The two letter code is based on ISO standard 3166.	https://ddwiki.reso.org/display/DDW17/FK
RESO::Country	FM	FM	Micronesia is the country in which the individual, entity or property is located. The two letter code is based on ISO standard 3166.	https://ddwiki.reso.org/display/DDW17/FM
RESO::Country	FO	FO	Faroe Islands is the country in which the individual, entity or property is located. The two letter code is based on ISO standard 3166.	https://ddwiki.reso.org/display/DDW17/FO
RESO::Country	FR	FR	France is the country in which the individual, entity or property is located. The two letter code is based on ISO standard 3166.	https://ddwiki.reso.org/display/DDW17/FR
RESO::Country	GA	GA	Gabon is the country in which the individual, entity or property is located. The two letter code is based on ISO standard 3166.	https://ddwiki.reso.org/display/DDW17/GA
RESO::Country	GB	GB	United Kingdom is the country in which the individual, entity or property is located. The two letter code is based on ISO standard 3166.	https://ddwiki.reso.org/display/DDW17/GB
RESO::Country	GD	GD	Grenada is the country in which the individual, entity or property is located. The two letter code is based on ISO standard 3166.	https://ddwiki.reso.org/display/DDW17/GD
RESO::Country	GE	GE	Georgia is the country in which the individual, entity or property is located. The two letter code is based on ISO standard 3166.	https://ddwiki.reso.org/display/DDW17/GE
RESO::Country	GF	GF	French Guiana is the country in which the individual, entity or property is located. The two letter code is based on ISO standard 3166.	https://ddwiki.reso.org/display/DDW17/GF
RESO::Country	GG	GG	Guernsey is the country in which the individual, entity or property is located. The two letter code is based on ISO standard 3166.	https://ddwiki.reso.org/display/DDW17/GG
RESO::Country	GH	GH	Ghana is the country in which the individual, entity or property is located. The two letter code is based on ISO standard 3166.	https://ddwiki.reso.org/display/DDW17/GH
RESO::Country	GI	GI	Gibraltar is the country in which the individual, entity or property is located. The two letter code is based on ISO standard 3166.	https://ddwiki.reso.org/display/DDW17/GI
RESO::Country	GL	GL	Greenland is the country in which the individual, entity or property is located. The two letter code is based on ISO standard 3166.	https://ddwiki.reso.org/display/DDW17/GL
RESO::Country	GM	GM	Gambia is the country in which the individual, entity or property is located. The two letter code is based on ISO standard 3166.	https://ddwiki.reso.org/display/DDW17/GM
RESO::Country	GN	GN	Guinea is the country in which the individual, entity or property is located. The two letter code is based on ISO standard 3166.	https://ddwiki.reso.org/display/DDW17/GN
RESO::Country	GP	GP	Guadeloupe is the country in which the individual, entity or property is located. The two letter code is based on ISO standard 3166.	https://ddwiki.reso.org/display/DDW17/GP
RESO::Country	GQ	GQ	Equatorial Guinea is the country in which the individual, entity or property is located. The two letter code is based on ISO standard 3166.	https://ddwiki.reso.org/display/DDW17/GQ
RESO::Country	GR	GR	Greece is the country in which the individual, entity or property is located. The two letter code is based on ISO standard 3166.	https://ddwiki.reso.org/display/DDW17/GR
RESO::Country	GS	GS	South Georgia is the country in which the individual, entity or property is located. The two letter code is based on ISO standard 3166.	https://ddwiki.reso.org/display/DDW17/GS
RESO::Country	GT	GT	Guatemala is the country in which the individual, entity or property is located. The two letter code is based on ISO standard 3166.	https://ddwiki.reso.org/display/DDW17/GT
RESO::Country	GU	GU	Guam is the country in which the individual, entity or property is located. The two letter code is based on ISO standard 3166.	https://ddwiki.reso.org/display/DDW17/GU
RESO::Country	GW	GW	Guinea-Bissau is the country in which the individual, entity or property is located. The two letter code is based on ISO standard 3166.	https://ddwiki.reso.org/display/DDW17/GW
RESO::Country	GY	GY	Guyana is the country in which the individual, entity or property is located. The two letter code is based on ISO standard 3166.	https://ddwiki.reso.org/display/DDW17/GY
RESO::Country	HK	HK	Hong Kong is the country in which the individual, entity or property is located. The two letter code is based on ISO standard 3166.	https://ddwiki.reso.org/display/DDW17/HK
RESO::Country	HM	HM	Heard And McDonald Islands is the country in which the individual, entity or property is located. The two letter code is based on ISO standard 3166.	https://ddwiki.reso.org/display/DDW17/HM
RESO::Country	HN	HN	Honduras is the country in which the individual, entity or property is located. The two letter code is based on ISO standard 3166.	https://ddwiki.reso.org/display/DDW17/HN
RESO::Country	HR	HR	Croatia is the country in which the individual, entity or property is located. The two letter code is based on ISO standard 3166.	https://ddwiki.reso.org/display/DDW17/HR
RESO::Country	HT	HT	Haiti is the country in which the individual, entity or property is located. The two letter code is based on ISO standard 3166.	https://ddwiki.reso.org/display/DDW17/HT
RESO::Country	HU	HU	Hungary is the country in which the individual, entity or property is located. The two letter code is based on ISO standard 3166.	https://ddwiki.reso.org/display/DDW17/HU
RESO::Country	ID	ID	Indonesia is the country in which the individual, entity or property is located. The two letter code is based on ISO standard 3166.	https://ddwiki.reso.org/display/DDW17/ID
