type	value	display_name	definition	wiki_url
RESO::GreenSustainability	RecycledMaterials	Recycled Materials	Structure includes multiple products that have a significant amount of postconsumer recycled content. Major green building programs tend to use 25 percent postconsumer recycled content as a threshold. Postindustrial recycled content tends to count toward overall content, but to a less scale. Some more common examples of recycled content materials include masonry, paving stones, or foundations with fly ash; aluminum gutters and downspouts; decking; drywall fibers, insulation, and house wrap; vinyl plastics; countertops; and cabinets, interior doors, or trim. More details are available on Home Innovation Research Labs “Browse Green Certified Products” tool or LEED Environmentally Preferred Products credit table.	https://ddwiki.reso.org/display/DDW17/Recycled+Materials
RESO::GreenSustainability	RegionallySourcedMaterials	Regionally-Sourced Materials	Refers to building materials that were manufactured, extracted, harvested, or recovered within 500 miles of the building. Several major green building programs define regionally sourced as within a 500-mile radius.	https://ddwiki.reso.org/display/DDW17/Regionally-Sourced+Materials
RESO::GreenSustainability	RenewableMaterials	Renewable Materials	Structure includes materials that are naturally occurring, abundant, and/or fast-growing materials. Some products are certified to come from fast-growing or otherwise renewable sources such as flooring and wood products. Some materials may be bio-based, which means they have been processed from once-living materials such as paper, straw, soy, natural fibers, and crops.	https://ddwiki.reso.org/display/DDW17/Renewable+Materials
RESO::GreenSustainability	SalvagedMaterials	Salvaged Materials	Structure incorporates materials that were diverted from a landfill and/or sourced to give an otherwise unused item fresh use as an attached fixture. May include bricks, timbers, roofing, flooring, walls, cabinets, doors, etc.	https://ddwiki.reso.org/display/DDW17/Salvaged+Materials
RESO::GreenVerificationSource	Administrator	Administrator	An administrator such as a utility, governmental entity, etc. provided data such as photovoltaic characteristics, or a verified score, certification, label, etc.	https://ddwiki.reso.org/display/DDW17/Administrator
RESO::GreenVerificationSource	Assessor	Assessor	The assessor provided data such as photovoltaic characteristics, or a verified score, certification, label, etc.	https://ddwiki.reso.org/pages/viewpage.action?pageId=29244921
RESO::GreenVerificationSource	Builder	Builder	The builder provided data such as photovoltaic characteristics, or a verified score, certification, label, etc.	https://ddwiki.reso.org/pages/viewpage.action?pageId=29244922
RESO::GreenVerificationSource	ContractorOrInstaller	Contractor or Installer	The contractor or installer provided data such as photovoltaic characteristics, or a verified score, certification, label, etc.	https://ddwiki.reso.org/display/DDW17/Contractor+or+Installer
RESO::GreenVerificationSource	Other	Other	Data such as photovoltaic characteristics, or a verified score, certification, label, etc. was received from another party not listed.	https://ddwiki.reso.org/pages/viewpage.action?pageId=29244924
RESO::GreenVerificationSource	Owner	Owner	The owner provided data such as photovoltaic characteristics, or a verified score, certification, label, etc.	https://ddwiki.reso.org/pages/viewpage.action?pageId=29244925
RESO::GreenVerificationSource	ProgramSponsor	Program Sponsor	The program sponsor provided data such as photovoltaic characteristics, or a verified score, certification, label, etc.	https://ddwiki.reso.org/display/DDW17/Program+Sponsor
RESO::GreenVerificationSource	ProgramVerifier	Program Verifier	The program verifier hired as a third-party provided data such as photovoltaic characteristics, or a verified score, certification, label, etc.	https://ddwiki.reso.org/display/DDW17/Program+Verifier
RESO::GreenVerificationSource	PublicRecords	Public Records	Data such as photovoltaic characteristics, or a verified score, certification, label, etc. was received from public record such as a building permit.	https://ddwiki.reso.org/pages/viewpage.action?pageId=29244928
RESO::GreenVerificationSource	SeeRemarks	See Remarks	See remarks for information about the source of data such as photovoltaic characteristics, or a verified score, certification, label, etc.	https://ddwiki.reso.org/pages/viewpage.action?pageId=29244929
RESO::GreenVerificationStatus	Complete	Complete	Indicates that verification process is complete.  All requirements are complete and official verification documentation is on file or published; or more than 12 months of occupancy.	https://ddwiki.reso.org/display/DDW17/Complete
RESO::GreenVerificationStatus	InProcess	In Process	Indicates that verification process is underway, but not complete.  Application, plans testing or specifications in process; or may be less than 12 months of occupancy.	https://ddwiki.reso.org/display/DDW17/In+Process
RESO::GreenWaterConservation	EfficientHotWaterDistribution	Efficient Hot Water Distribution	Efficient hot water distribution systems are designed to generate hot water using fewer fuel resources, and to get hot water to low-flow faucets and fixtures more quickly. These systems often feature carefully designed plumbing lines that are less redundant and/or shorter. Rather than measuring time to hot water at a fixture in gallons, efficient distribution systems can be measured in cups. EPA WaterSense Guide for Hot Water Distribution as well as several green building programs have further details. This may also be known as Structured Plumbing.	https://ddwiki.reso.org/display/DDW17/Efficient+Hot+Water+Distribution
RESO::GreenWaterConservation	GrayWaterSystem	Gray Water System	The property includes a grey water system.	https://ddwiki.reso.org/display/DDW17/Gray+Water+System
RESO::GreenWaterConservation	GreenInfrastructure	Green Infrastructure	Green Infrastructure is a set of strategies and specifically designed systems to manage stormwater runoff through a variety of small, cost-effective landscape features located on a property. Green Infrastructure employs infiltration (allowing water to slowly sink into the soil), evaporation/transpiration using native vegetation, and rainwater capture and reuse (storing runoff to water plants, flush toilets, etc.). May include green roof, rain gardens, rain barrels, permeable paving, etc. EPA Green Infrastructure webpage has more information	https://ddwiki.reso.org/display/DDW17/Green+Infrastructure
RESO::GreenWaterConservation	LowFlowFixtures	Low-Flow Fixtures	Toilets, bathroom faucets, showerheads, irrigation controllers, and other products can be manufactured to use less water than minimum standards. Some products are qualified by third-party programs like the EPA WaterSense and are typically at least 20 percent more water-efficient than standard products. EPA WaterSense website has additional information	https://ddwiki.reso.org/display/DDW17/Low-Flow+Fixtures
RESO::GreenWaterConservation	WaterRecycling	Water Recycling	The property includes a system to reuse stormwater via rain barrels or cisterns for landscaping, or to treat and reuse water from bathroom sinks, showers, and clothes washing drains for landscape irrigation and/or toilet flushing.	https://ddwiki.reso.org/display/DDW17/Water+Recycling
RESO::GreenWaterConservation	WaterSmartLandscaping	Water-Smart Landscaping	Water-smart landscapes are designed to require less water and fertilizer treatments. These landscapes feature regionally appropriate plants that require low water and are native to the local climate. Plants are organized by hydrozones (watering needs). Any irrigation system is qualified for high water-efficiency. Turfgrass is minimized and grown to the tallest height recommended. Strategic maintenance includes mulching and soil aeration. Other details are documented in EPA’s Water-Smart Landscape Design Tips.	https://ddwiki.reso.org/display/DDW17/Water-Smart+Landscaping
RESO::Heating	ActiveSolar	Active Solar	Active solar heating systems use solar energy to heat a fluid -- either liquid or air -- and then transfer the solar heat directly to the interior space or to a storage system for later use.	https://ddwiki.reso.org/display/DDW17/Active+Solar
RESO::Heating	Baseboard	Baseboard	Baseboard heating utilizes convection, as cold air drops from the window, it enters the baseboard heating unit where the air is warmed by heating elements, typically fins.	https://ddwiki.reso.org/display/DDW17/Baseboard
RESO::Heating	Ceiling	Ceiling	A heating unit that is installed into, or upon the surface, of the ceiling.	https://ddwiki.reso.org/display/DDW17/Ceiling
RESO::Heating	Central	Central	A system where heat is generated in one or more locations in the structure and distributed throughout the structure.  The term ”Central” is commonly understood as distribution done by ducting air.  Piping a fluid to radiators is also a central type of heating, but this can be clarified with the options ”Radiator” and ”Forced Air”.	https://ddwiki.reso.org/display/DDW17/Central
RESO::Heating	Coal	Coal	The heating system uses coal as its fuel to generate heat.	https://ddwiki.reso.org/display/DDW17/Coal
RESO::Heating	CoalStove	Coal Stove	A coal burning stove that is used for heat.	https://ddwiki.reso.org/display/DDW17/Coal+Stove
RESO::Heating	Ductless	Ductless	The heating system does not have ducting like that found in central forced air systems.	https://ddwiki.reso.org/pages/viewpage.action?pageId=29244958
RESO::Heating	Electric	Electric	A heating system that utilizes electricity and heating elements, such as coils or fins, to generate heat.	https://ddwiki.reso.org/pages/viewpage.action?pageId=29244959
RESO::Heating	EnergyStarAccaRsiQualifiedInstallation	ENERGY STAR/ACCA RSI Qualified Installation	The heating system installation was done by an ENERGY STAR or ACCA RSI qualified contractor.	https://ddwiki.reso.org/pages/viewpage.action?pageId=29244960
RESO::Heating	EnergyStarQualifiedEquipment	ENERGY STAR Qualified Equipment	The heating system is ENERGY STAR Qualified.  Specific performance information must be determined by review of the actual unit.	https://ddwiki.reso.org/pages/viewpage.action?pageId=29244961
RESO::Heating	ExhaustFan	Exhaust Fan	The property has an exhaust fan.	https://ddwiki.reso.org/pages/viewpage.action?pageId=29244962
RESO::Heating	FireplaceInsert	Fireplace Insert	The property has a fireplace insert for generating heat.	https://ddwiki.reso.org/display/DDW17/Fireplace+Insert
RESO::Heating	Fireplaces	Fireplace(s)	The property has one or more fireplaces used to generate heat.	https://ddwiki.reso.org/pages/viewpage.action?pageId=29244963
RESO::Heating	FloorFurnace	Floor Furnace	A radiant heating system that is mounted into the floor and distributes the heat via convection.	https://ddwiki.reso.org/display/DDW17/Floor+Furnace
RESO::Heating	ForcedAir	Forced Air	The property has a forced air system, typically via ducting throughout the structure.	https://ddwiki.reso.org/display/DDW17/Forced+Air
RESO::Heating	Geothermal	Geothermal	A geothermal heating system, also known as a ground source heat pump, transfers heat from below ground into the structure.	https://ddwiki.reso.org/pages/viewpage.action?pageId=29244967
RESO::Heating	Gravity	Gravity	A gravity heating system, also known as an octopus furnace, is typically a ducted system that doesn't use a fan, but rather is designed to allow the heat to rise naturally thought the ducts to the different areas of the structure.	https://ddwiki.reso.org/display/DDW17/Gravity
RESO::Heating	HeatPump	Heat Pump	A system that exchanges heat between a warm and cool space.  The heat exchange is done between the dwelling and another air space, like outdoors; or a water source; or below ground (geothermal).	https://ddwiki.reso.org/pages/viewpage.action?pageId=29244969
RESO::Heating	HotWater	Hot Water	The heating system uses a boiler and pipes to deliver hot water to radiators throughout the dwelling.	https://ddwiki.reso.org/pages/viewpage.action?pageId=29244970
RESO::Heating	HumidityControl	Humidity Control	The heating system has humidity control.	https://ddwiki.reso.org/pages/viewpage.action?pageId=29244971
RESO::Heating	Kerosene	Kerosene	The heating system uses kerosene as its fuel to generate heat.	https://ddwiki.reso.org/display/DDW17/Kerosene
RESO::Heating	NaturalGas	Natural Gas	The heating system uses natural gas as its fuel to generate heat.	https://ddwiki.reso.org/display/DDW17/Natural+Gas
RESO::Heating	None	None	The property does not have a heating system.	https://ddwiki.reso.org/pages/viewpage.action?pageId=29244974
RESO::Heating	Oil	Oil	The heating system uses oil as its fuel to generate heat.	https://ddwiki.reso.org/display/DDW17/Oil
RESO::Heating	Other	Other	The property has a heating system or features that are not included in this list.	https://ddwiki.reso.org/pages/viewpage.action?pageId=29244976
RESO::Heating	PassiveSolar	Passive Solar	Passive solar is a building design where the walls, windows, floors, etc., are made to collect heat and warm the dwelling.	https://ddwiki.reso.org/display/DDW17/Passive+Solar
RESO::Heating	PelletStove	Pellet Stove	The property has a stove that burns compressed wood or biomass pellets to generate heat.	https://ddwiki.reso.org/pages/viewpage.action?pageId=29244978
RESO::Heating	Propane	Propane	The heating system uses propane as its fuel to generate heat.	https://ddwiki.reso.org/pages/viewpage.action?pageId=29244979
RESO::Heating	PropaneStove	Propane Stove	The property has a stove that burns propane to generate heat.	https://ddwiki.reso.org/display/DDW17/Propane+Stove
RESO::Heating	Radiant	Radiant	The heating system uses radiators to release heat within the dwelling.  The heat is typically delivered to the radiator(s) by water/steam or electricity.	https://ddwiki.reso.org/display/DDW17/Radiant
RESO::Heating	RadiantCeiling	Radiant Ceiling	The radiant heating element(s) are located in the ceiling.	https://ddwiki.reso.org/display/DDW17/Radiant+Ceiling
RESO::Heating	RadiantFloor	Radiant Floor	The radiant heating element(s) are located in the floor.	https://ddwiki.reso.org/display/DDW17/Radiant+Floor
RESO::Heating	SeeRemarks	See Remarks	See the remarks fields for additional information about the heating system included with the property.	https://ddwiki.reso.org/pages/viewpage.action?pageId=29244984
RESO::Heating	SeparateMeters	Separate Meters	The heating system has multiple units and/or is zoned with separate meters for each zone/unit.	https://ddwiki.reso.org/pages/viewpage.action?pageId=29244985
RESO::Heating	Solar	Solar	The property has a heating system or method that uses an unspecified type of solar heating.	https://ddwiki.reso.org/pages/viewpage.action?pageId=29244986
RESO::Heating	SpaceHeater	Space Heater	The property comes with a stand-alone space heater.	https://ddwiki.reso.org/display/DDW17/Space+Heater
RESO::Heating	Steam	Steam	The heating system uses a boiler and pipes to deliver hot water to radiators throughout the dwelling.	https://ddwiki.reso.org/display/DDW17/Steam
RESO::Heating	VariesByUnit	Varies by Unit	The type of heating or heating features vary from unit to unit.	https://ddwiki.reso.org/pages/viewpage.action?pageId=29244989
RESO::Heating	WallFurnace	Wall Furnace	Typically a ductless system that is built into a wall to deliver to the room in which it's installed.	https://ddwiki.reso.org/display/DDW17/Wall+Furnace
RESO::Heating	Wood	Wood	The heating system uses wood as its fuel to generate heat.	https://ddwiki.reso.org/pages/viewpage.action?pageId=29244991
RESO::Heating	WoodStove	Wood Stove	The property has a stove that burns wood to generate heat.	https://ddwiki.reso.org/display/DDW17/Wood+Stove
RESO::Heating	Zoned	Zoned	The heating system is zoned allowing for indepenant control of two or more parts of the structure.	https://ddwiki.reso.org/pages/viewpage.action?pageId=29244993
RESO::HorseAmenity	Arena	Arena	The property allows for horses and has an arena.	https://ddwiki.reso.org/pages/viewpage.action?pageId=29244995
RESO::HorseAmenity	Barn	Barn	The property allows horses and has a barn.	https://ddwiki.reso.org/pages/viewpage.action?pageId=29244996
RESO::HorseAmenity	BoardingFacilities	Boarding Facilities	The property had horse boarding facilities.	https://ddwiki.reso.org/display/DDW17/Boarding+Facilities
RESO::HorseAmenity	Corrals	Corral(s)	The property allows horses and has one or more corrals.	https://ddwiki.reso.org/pages/viewpage.action?pageId=29244998
RESO::HorseAmenity	HayStorage	Hay Storage	The property allows horses and has hay storage.	https://ddwiki.reso.org/display/DDW17/Hay+Storage
RESO::HorseAmenity	None	None	The property either does not allow horses or has no amenities for horses.	https://ddwiki.reso.org/pages/viewpage.action?pageId=29245000
RESO::HorseAmenity	Other	Other	The property has horse amenities other than those in this list.	https://ddwiki.reso.org/pages/viewpage.action?pageId=29245001
RESO::HorseAmenity	Paddocks	Paddocks	The property allows horses and has an enclosed living are for your horse(s).  A paddock is also known as a sacrifice area which got its name because the owner was sacrificing some of their land for the benefit of the horse.	https://ddwiki.reso.org/display/DDW17/Paddocks
RESO::HorseAmenity	PalpationChute	Palpation Chute	A portion of the livestock chute where the animal is held for examination or other purposes.	https://ddwiki.reso.org/display/DDW17/Palpation+Chute
RESO::HorseAmenity	Pasture	Pasture	The property includes or has access to a pasture for horses.	https://ddwiki.reso.org/pages/viewpage.action?pageId=29245004
RESO::HorseAmenity	RidingTrail	Riding Trail	The property includes or has access to a riding trail(s).	https://ddwiki.reso.org/display/DDW17/Riding+Trail
RESO::HorseAmenity	RoundPen	Round Pen	The property includes or has access to a round enclosure used for horse training.	https://ddwiki.reso.org/display/DDW17/Round+Pen
RESO::HorseAmenity	SeeRemarks	See Remarks	See the remarks fields for additional information about horse amenities.	https://ddwiki.reso.org/pages/viewpage.action?pageId=29245007
RESO::HorseAmenity	ShavingBin	Shaving Bin	The property includes or has access to a storage container for wood shavings that are use as ground cover for horses.	https://ddwiki.reso.org/display/DDW17/Shaving+Bin
RESO::HorseAmenity	Stables	Stable(s)	The property includes or has access to horse stable(s).	https://ddwiki.reso.org/pages/viewpage.action?pageId=29245009
RESO::HorseAmenity	TackRoom	Tack Room	The property includes or has access to a room to store equipment such as saddles, stirrups, bridles, halters, reins, bits, harnesses, martingales, breastplates, etc.	https://ddwiki.reso.org/display/DDW17/Tack+Room
RESO::HorseAmenity	TrailerStorage	Trailer Storage	The property includes or has access to a place to store a horse trailer.	https://ddwiki.reso.org/display/DDW17/Trailer+Storage
RESO::HorseAmenity	WashRack	Wash Rack	The property includes or has access to a rack used to confine/restrain a horse for purposes of washing the horse.	https://ddwiki.reso.org/display/DDW17/Wash+Rack
RESO::HoursDaysOfOperation	EveningsOnly	Evenings Only	The business being sold is open in the evenings only.	https://ddwiki.reso.org/display/DDW17/Evenings+Only
RESO::HoursDaysOfOperation	Open24Hours	Open 24 Hours	The business being sold is open 24 hours per day.	https://ddwiki.reso.org/display/DDW17/Open+24+Hours
RESO::HoursDaysOfOperation	Open7Days	Open 7 Days	The business being sold is open 7 days per week.	https://ddwiki.reso.org/display/DDW17/Open+7+Days
RESO::HoursDaysOfOperation	Open8HoursDay	Open 8 Hours/Day	The business being sold is open 8 hours per day.	https://ddwiki.reso.org/pages/viewpage.action?pageId=29244945
RESO::HoursDaysOfOperation	OpenLessThan8HoursDay	Open -8 Hours/Day	The business being sold is open less than 8 hours per day.	https://ddwiki.reso.org/pages/viewpage.action?pageId=29244946
RESO::HoursDaysOfOperation	OpenMondayFriday	Open Monday-Friday	The business being sold is open Monday through Friday.	https://ddwiki.reso.org/display/DDW17/Open+Monday-Friday
RESO::HoursDaysOfOperation	OpenOver8HoursDay	Open 8+ Hours/Day	The business being sold is open more than 8 hours/day.	https://ddwiki.reso.org/pages/viewpage.action?pageId=29244947
RESO::HoursDaysOfOperation	OpenSaturday	Open Saturday	The business being sold is open on Saturdays.	https://ddwiki.reso.org/display/DDW17/Open+Saturday
RESO::HoursDaysOfOperation	OpenSunday	Open Sunday	The business being sold is open on Sundays.	https://ddwiki.reso.org/display/DDW17/Open+Sunday
RESO::ImageOf	AerialView	Aerial View	The image/photo is an areal view of the structure or property.	https://ddwiki.reso.org/display/DDW17/Aerial+View
RESO::ImageOf	Atrium	Atrium	The image/photo is of the atrium.	https://ddwiki.reso.org/display/DDW17/Atrium
RESO::ImageOf	Attic	Attic	The image/photo is of the attic.	https://ddwiki.reso.org/display/DDW17/Attic
RESO::ImageOf	BackOfStructure	Back of Structure	The image/photo is of the back of the structure.	https://ddwiki.reso.org/display/DDW17/Back+of+Structure
RESO::ImageOf	Balcony	Balcony	The image/photo is of a balcony.	https://ddwiki.reso.org/display/DDW17/Balcony
RESO::ImageOf	Bar	Bar	The image/photo is of the bar.	https://ddwiki.reso.org/display/DDW17/Bar
RESO::ImageOf	Barn	Barn	The image/photo is of the barn.	https://ddwiki.reso.org/display/DDW17/Barn
RESO::ImageOf	Basement	Basement	The image/photo is of the basement.	https://ddwiki.reso.org/display/DDW17/Basement
RESO::ImageOf	Bathroom	Bathroom	The image/photo is of a bathroom.	https://ddwiki.reso.org/display/DDW17/Bathroom
RESO::ImageOf	Bedroom	Bedroom	The image/photo is of a bedroom.	https://ddwiki.reso.org/display/DDW17/Bedroom
RESO::ImageOf	BonusRoom	Bonus Room	The image/photo is of the bonus room.	https://ddwiki.reso.org/display/DDW17/Bonus+Room
RESO::ImageOf	BreakfastArea	Breakfast Area	The image/photo is of the breakfast area.	https://ddwiki.reso.org/display/DDW17/Breakfast+Area
RESO::ImageOf	Closet	Closet	The image/photo is of a closet.	https://ddwiki.reso.org/display/DDW17/Closet
RESO::ImageOf	Community	Community	The image/photo is of the community.	https://ddwiki.reso.org/display/DDW17/Community
RESO::ImageOf	Courtyard	Courtyard	The image/photo is of the courtyard.	https://ddwiki.reso.org/display/DDW17/Courtyard
RESO::ImageOf	Deck	Deck	The image/photo is of the deck.	https://ddwiki.reso.org/display/DDW17/Deck
RESO::ImageOf	Den	Den	The image/photo is of the den.	https://ddwiki.reso.org/display/DDW17/Den
RESO::ImageOf	DiningArea	Dining Area	The image/photo is of the dining area.	https://ddwiki.reso.org/display/DDW17/Dining+Area
RESO::ImageOf	DiningRoom	Dining Room	The image/photo is of the dining room.	https://ddwiki.reso.org/display/DDW17/Dining+Room
RESO::ImageOf	Dock	Dock	The image/photo is of the dock.	https://ddwiki.reso.org/display/DDW17/Dock
RESO::ImageOf	Entry	Entry	The image/photo is of the entry.	https://ddwiki.reso.org/display/DDW17/Entry
RESO::ImageOf	ExerciseRoom	Exercise Room	The image/photo is of the exercise room.	https://ddwiki.reso.org/display/DDW17/Exercise+Room
RESO::ImageOf	FamilyRoom	Family Room	The image/photo is of the family room.	https://ddwiki.reso.org/display/DDW17/Family+Room
RESO::ImageOf	Fence	Fence	The image/photo is of the fence.	https://ddwiki.reso.org/display/DDW17/Fence
RESO::ImageOf	Fireplace	Fireplace	The image/photo is of a fireplace.	https://ddwiki.reso.org/display/DDW17/Fireplace
RESO::ImageOf	FloorPlan	Floor Plan	The image/photo is of the floor plan.	https://ddwiki.reso.org/display/DDW17/Floor+Plan
RESO::ImageOf	FrontOfStructure	Front of Structure	The image/photo is of the front of structure.	https://ddwiki.reso.org/display/DDW17/Front+of+Structure
RESO::ImageOf	GameRoom	Game Room	The image/photo is of the game room.	https://ddwiki.reso.org/display/DDW17/Game+Room
RESO::ImageOf	Garage	Garage	The image/photo is of the garage.	https://ddwiki.reso.org/display/DDW17/Garage
RESO::ImageOf	Garden	Garden	The image/photo is of the garden.	https://ddwiki.reso.org/display/DDW17/Garden
RESO::ImageOf	GolfCourse	Golf Course	The image/photo is of a golf course.	https://ddwiki.reso.org/display/DDW17/Golf+Course
RESO::ImageOf	GreatRoom	Great Room	The image/photo is of the great room.	https://ddwiki.reso.org/display/DDW17/Great+Room
RESO::ImageOf	GuestQuarters	Guest Quarters	The image/photo is of the guest quarters.	https://ddwiki.reso.org/display/DDW17/Guest+Quarters
RESO::ImageOf	Gym	Gym	The image/photo is of the gym.	https://ddwiki.reso.org/display/DDW17/Gym
RESO::ImageOf	HobbyRoom	Hobby Room	The image/photo is of the hobby room.	https://ddwiki.reso.org/display/DDW17/Hobby+Room
RESO::ImageOf	Inlaw	Inlaw	The image/photo is of the inlaw / mother-in-law quarters/room.	https://ddwiki.reso.org/display/DDW17/Inlaw
RESO::ImageOf	Kitchen	Kitchen	The image/photo is of the kitchen.	https://ddwiki.reso.org/display/DDW17/Kitchen
RESO::ImageOf	Lake	Lake	The image/photo is of the lake.	https://ddwiki.reso.org/display/DDW17/Lake
RESO::ImageOf	Laundry	Laundry	The image/photo is of the laundry.	https://ddwiki.reso.org/display/DDW17/Laundry
RESO::ImageOf	Library	Library	The image/photo is of the library.	https://ddwiki.reso.org/display/DDW17/Library
RESO::ImageOf	LivingRoom	Living Room	The image/photo is of the living room.	https://ddwiki.reso.org/display/DDW17/Living+Room
RESO::ImageOf	LoadingDock	Loading Dock	The image/photo is of the loading dock.	https://ddwiki.reso.org/display/DDW17/Loading+Dock
RESO::ImageOf	Lobby	Lobby	The image/photo is of the lobby.	https://ddwiki.reso.org/display/DDW17/Lobby
RESO::ImageOf	Loft	Loft	The image/photo is of the loft.	https://ddwiki.reso.org/display/DDW17/Loft
RESO::ImageOf	Lot	Lot	The image/photo is of the lot.	https://ddwiki.reso.org/display/DDW17/Lot
