type	value	display_name	definition	wiki_url
RESO::AccessibilityFeature	AccessibleApproachWithRamp	Accessible Approach with Ramp	A minimum of one entrance to the structure with clear, evenly-paved walkway from parking area or pedestrian arrival area; Path of travel does not include a running slope in excess of 1:12 (8.33%); a cross slope exceeding 1:50 (2%); nor level changes of more than 1/2 inch; if slope is over 5%, handrails are required.  Level landing; 32 inch clear width opening doors; and adequate lighting on pathway and landing.  This is required to be considered ”Visitable”.	https://ddwiki.reso.org/display/DDW17/Accessible+Approach+with+Ramp
RESO::AccessibilityFeature	AccessibleBedroom	Accessible Bedroom	Bedroom has adequate turnaround of 60 inches or other approved turnaround configuration; Closet doors have 32 inch clearance.  Accessible environmental controls. Multiple lighting fixtures.  This is required to be considered Enhanced Accessible.  Optional: Some lower-height storage in closet.   Remote control of lighting and environmental controls.	https://ddwiki.reso.org/display/DDW17/Accessible+Bedroom
RESO::AccessibilityFeature	AccessibleCentralLivingArea	Accessible Central Living Area	Hard surface flooring or low-pile carpet, securely attached along edges. Entrances to all rooms on all floors provide 36 inch clear passage. Multiple lighting fixtures installed to provide adaptable lighting for general purpose and tasks.  This is required to be considered Enhanced Accessible.	https://ddwiki.reso.org/display/DDW17/Accessible+Central+Living+Area
RESO::AccessibilityFeature	AccessibleClosets	Accessible Closets	Closet doors are 32” clearance throughout Central Living Area.	https://ddwiki.reso.org/display/DDW17/Accessible+Closets
RESO::AccessibilityFeature	AccessibleCommonArea	Accessible Common Area	Common Area, used for entertaining guests, is level, with 36-inch passage through and around the space.  Required to be considered Visitable.	https://ddwiki.reso.org/display/DDW17/Accessible+Common+Area
RESO::AccessibilityFeature	AccessibleDoors	Accessible Doors	Minimum 32 inches clear passage; levered handle; threshold, if present, maximum 1/2-inch, but beveled on both sides when over 1/4 inch. Required to be considered Visitable or Enhanced Accessible.	https://ddwiki.reso.org/display/DDW17/Accessible+Doors
RESO::AccessibilityFeature	AccessibleElectricalAndEnvironmentalControls	Accessible Electrical and Environmental Controls	Thermostats and security system controls located on floor with central living area. Control devices  for light switches and thermostats at 42-48 inches height off floor and side- to-side. Electrical plugs minimum of 18 inches above floor. This is required to be considered Enhanced Accessible.  Optional: Rocker-style light switches; Lighted switches; Automatic/remote control for environmental controls.	https://ddwiki.reso.org/display/DDW17/Accessible+Electrical+and+Environmental+Controls
RESO::AccessibilityFeature	AccessibleElevatorInstalled	Accessible Elevator Installed	Elevator with minimum 32” door and minimum  36” x 48” turning radius.	https://ddwiki.reso.org/display/DDW17/Accessible+Elevator+Installed
RESO::AccessibilityFeature	AccessibleEntrance	Accessible Entrance	Entrance door is a minimum of 32 inches wide; threshold , when present,  maximum 1/2-inch, but when over 1/4-inch, is beveled on both sides. The entry door has lever handle for egress.   This is required to be considered Visitable.  Optional: Entryway is covered; Bench near outside entry door; Motion-detection outside lights. Accessible peephole or other method for inside viewing of anyone outside the entry door.  House number easily visible from street by emergency responders.	https://ddwiki.reso.org/display/DDW17/Accessible+Entrance
RESO::AccessibilityFeature	AccessibleForHearingImpairment	Accessible for Hearing-Impairment	Home is wired for  flashing lights and/or vibrating smoke alarm, door bell, other alerting  features.	https://ddwiki.reso.org/display/DDW17/Accessible+for+Hearing-Impairment
RESO::AccessibilityFeature	AccessibleFullBath	Accessible Full Bath	Bathroom has adequate turnaround: 60 inches or other approved turnaround configuration.  Accessible bathing area:  Roll-in shower or space for shower chair or transfer bench in bathtub. Slip-resistant surface on bathroom floor and bathtub/shower.  Roll-under or side-access to sink, with padded trap. Lighting directly over shower/bathing areas, in addition to general bathroom lighting.  This is required to be considered Enhanced Accessible.  Optional: Removable cabinet doors and base under sink.  Grab bars with shear force of 250 pounds, installed around toilet and shower/tub, with proper backing.  Hand-held and/or height-adjustable shower head; automatic water temperature controlled (anti-scald) tub/shower; offset tub/shower controls toward front edge of tub/shower for easy access.   Raised toilet (17-19 inches minimum).	https://ddwiki.reso.org/display/DDW17/Accessible+Full+Bath
RESO::AccessibilityFeature	AccessibleHallways	Accessible Hallway(s)	Hallway is minimum 36, preferred 42 inches wide  (or adequate alternative based on individual configuration). At least one lighting fixture is present.	https://ddwiki.reso.org/pages/viewpage.action?pageId=29243658
RESO::AccessibilityFeature	AccessibleKitchen	Accessible Kitchen	40” clear turn-around, or 36” clear with clear under-counter space for T-turn space in kitchen, unimpeded by fixtures.  Roll-under/adaptable sink with padded trap or side-access to sink. Roll-out shelves in at least 50% of lower cabinets, Roll-under work area (36” clearance). Lighting fixtures directed over all task areas with adaptable control.  This is required to be considered Enhanced Accessible.  Optional:  Adaptable under-sink cabinet with removable doors and cabinet base.  Accessible features for upper kitchen cabinets.  Space for side-by-side refrigerator (minimum 36 inches);  Contrasting color counter edges for vison accessibility.	https://ddwiki.reso.org/display/DDW17/Accessible+Kitchen
RESO::AccessibilityFeature	AccessibleKitchenAppliances	Accessible Kitchen Appliances	Stove controls in front or side, at counter top height; Oven with side-access door at counter level; Microwave is at counter level.  This is required to be considered Enhanced Accessible.  Optional:  Raised dishwasher.  Microwave  has clear work area below or to the right side.	https://ddwiki.reso.org/display/DDW17/Accessible+Kitchen+Appliances
RESO::AccessibilityFeature	AccessibleStairway	Accessible Stairway	Handrails on both sides of stairs, extended when possible, with shear force of 250 pounds. Interior and exterior stairs have adequate number of light fixtures for full coverage. Non-slip stair treads.  If stairs are carpeted, covering is non-moveable, low-pile carpet.  This is required to be considered Enhanced Accessible.  Optional: Stair treads are in high contrast colors for increased visibility.	https://ddwiki.reso.org/display/DDW17/Accessible+Stairway
RESO::AccessibilityFeature	AccessibleWasherDryer	Accessible Washer/Dryer	Raised clothes washer and/or dryer, front controls, side opening, both open to center.	https://ddwiki.reso.org/pages/viewpage.action?pageId=29243662
RESO::AccessibilityFeature	AdaptableBathroomWalls	Adaptable Bathroom Walls	Reinforced main bathroom walls, including bath or shower, to permit installation of grab bars (with shear force of 250 pounds) and/or fixtures in the future.   This is required to be considered Enhanced Accessible.	https://ddwiki.reso.org/display/DDW17/Adaptable+Bathroom+Walls
RESO::AccessibilityFeature	AdaptableForElevator	Adaptable For Elevator	Stacked closets in a multi-story house for possible future conversion to an elevator.	https://ddwiki.reso.org/display/DDW17/Adaptable+For+Elevator
RESO::AccessibilityFeature	CeilingTrack	Ceiling Track	Track installed in ceiling for lift chair (Hoyer lift).	https://ddwiki.reso.org/display/DDW17/Ceiling+Track
RESO::AccessibilityFeature	CentralLivingArea	Central Living Area	Central Living Area includes: Common Area, hallway(s), full or 3/4 bathroom,  kitchen, at least one bedroom, access to environmental controls, and access to floors above main floor, if necessary.	https://ddwiki.reso.org/display/DDW17/Central+Living+Area
RESO::AccessibilityFeature	CommonArea	Common Area	The Common Area is the portion of the home near accessible entrance, used for entertaining guests.	https://ddwiki.reso.org/display/DDW17/Common+Area
RESO::AccessibilityFeature	CustomizedWheelchairAccessible	Customized Wheelchair Accessible	Customized accessibility for specific size or style of wheelchair or scooter.	https://ddwiki.reso.org/display/DDW17/Customized+Wheelchair+Accessible
RESO::AccessibilityFeature	ElectronicEnvironmentalControls	Electronic Environmental Controls	Programmable electronic controls for thermostat, lights, security system and automatic doors.	https://ddwiki.reso.org/display/DDW17/Electronic+Environmental+Controls
RESO::AccessibilityFeature	EnhancedAccessible	Enhanced Accessible	The Central Living Area is fully accessible for lifelong living by all residents, no matter their ability. A person in a wheel chair or with other disability is able to  perform all personal and housekeeping tasks.  Persons without disabilities are also able to perform basic tasks with greater ease.  To be considered ”Enhanced Accessible” the home also includes all ”Visitable” features.	https://ddwiki.reso.org/display/DDW17/Enhanced+Accessible
RESO::AccessibilityFeature	ExteriorWheelchairLift	Exterior Wheelchair Lift	Mechanical wheelchair lift is installed outside the home to facilitate barrier-free approach.	https://ddwiki.reso.org/display/DDW17/Exterior+Wheelchair+Lift
RESO::AccessibilityFeature	GripAccessibleFeatures	Grip-Accessible Features	All doors, faucets and other mechanisms throughout central living area are lever, hands-free or other style that can be  controlled with a closed, clenched fist or weak hands.  This is required to be considered Enhanced Accessible.  Optional:  Wire pull (D-ring) handles or equivalent or easy touch latches on cabinets and drawers.	https://ddwiki.reso.org/display/DDW17/Grip-Accessible+Features
RESO::AccessibilityFeature	ReinforcedFloors	Reinforced Floors	Reinforced floors for bariatric needs, power wheelchairs, therapeutic tub or heavy medical equipment.	https://ddwiki.reso.org/display/DDW17/Reinforced+Floors
RESO::AccessibilityFeature	SafeEmergencyEgressFromHome	Safe Emergency Egress from Home	Minimum two, no-step, accessible egresses from Central Living Area.  Window locks are  19 to 54 inches from the floor and can be opened with a closed fist. Emergency egress windows in sleeping areas require minimal effort to open.  This is required to be considered Enhanced Accessible.	https://ddwiki.reso.org/display/DDW17/Safe+Emergency+Egress+from+Home
RESO::AccessibilityFeature	SmartTechnology	Smart Technology	Smart Home (computer-controlled) and/or smart products— for example, voice activated controls, voice reminder, remote monitoring of individuals with dementia.	https://ddwiki.reso.org/display/DDW17/Smart+Technology
RESO::AccessibilityFeature	StairLift	Stair Lift	Stair lift with motorized rail to climb interior or exterior stairway installed professionally.	https://ddwiki.reso.org/display/DDW17/Stair+Lift
RESO::AccessibilityFeature	StandbyGenerator	Standby Generator	Backup generator for refrigeration of medications, life-sustaining medical  equipment or essential room temperature control.	https://ddwiki.reso.org/display/DDW17/Standby+Generator
RESO::AccessibilityFeature	TherapeuticWhirlpool	Therapeutic Whirlpool	Therapeutic whirlpool, properly installed.	https://ddwiki.reso.org/display/DDW17/Therapeutic+Whirlpool
RESO::AccessibilityFeature	Visitable	Visitable	The home is “visitable” for all guests: a person in a wheel chair can easily enter the home and  access the main Common Area, a half-bathroom at minimum, and the hall leading to that bathroom.	https://ddwiki.reso.org/display/DDW17/Visitable
RESO::AccessibilityFeature	VisitorBathroom	Visitor Bathroom	Bathroom that is closest to Common Area. Minimum half bath. Door has minimum 32-inch clear width opening; lever handles. Minimum 60-inch turnaround or other approved turnaround configuration (30” x 48” clear space if door opens out.). Grab bar installed in toilet area with proper blocking. This is required to be considered Visitable.	https://ddwiki.reso.org/display/DDW17/Visitor+Bathroom
RESO::AccessibilityFeature	WalkerAccessibleStairs	Walker-Accessible Stairs	Treads are minimum 25 inches deep, with maximum 4 inches rise, minimum 36 inches wide.  May be a custom feature in addition to approach with ramp.	https://ddwiki.reso.org/display/DDW17/Walker-Accessible+Stairs
RESO::ActorType	Agent	Agent	The event was generated by what the source defines as a real estate professional	https://ddwiki.reso.org/pages/viewpage.action?pageId=29243683
RESO::ActorType	Bot	Bot	The event was generated by a bot or some type of scripting tool	https://ddwiki.reso.org/display/DDW17/Bot
RESO::ActorType	Client	Client	The event was generated by what the source defines as a registered client	https://ddwiki.reso.org/display/DDW17/Client
RESO::ActorType	Consumer	Consumer	The event was generated by what the source defines as a consumer	https://ddwiki.reso.org/display/DDW17/Consumer
RESO::ActorType	Unknown	Unknown	The generating Actor type could not be identified	https://ddwiki.reso.org/pages/viewpage.action?pageId=29243687
RESO::Appliance	BarFridge	Bar Fridge	A refrigerator that is sized and/or built to be part of a bar.	https://ddwiki.reso.org/display/DDW17/Bar+Fridge
RESO::Appliance	BuiltInElectricOven	Built-In Electric Oven	A built-in electric oven.	https://ddwiki.reso.org/display/DDW17/Built-In+Electric+Oven
RESO::Appliance	BuiltInElectricRange	Built-In Electric Range	A built-in electric range.	https://ddwiki.reso.org/display/DDW17/Built-In+Electric+Range
RESO::Appliance	BuiltInFreezer	Built-In Freezer	A built-in freezer.	https://ddwiki.reso.org/display/DDW17/Built-In+Freezer
RESO::Appliance	BuiltInGasOven	Built-In Gas Oven	A built-in gas oven	https://ddwiki.reso.org/display/DDW17/Built-In+Gas+Oven
RESO::Appliance	BuiltInGasRange	Built-In Gas Range	A built-in gas range.	https://ddwiki.reso.org/display/DDW17/Built-In+Gas+Range
RESO::Appliance	BuiltInRange	Built-In Range	A built-in range where the fuel type is not specified.	https://ddwiki.reso.org/display/DDW17/Built-In+Range
RESO::Appliance	BuiltInRefrigerator	Built-In Refrigerator	A built-in refrigerator	https://ddwiki.reso.org/display/DDW17/Built-In+Refrigerator
RESO::Appliance	ConvectionOven	Convection Oven	A convection oven (also known as a fan-assisted oven or simply a fan oven) is an oven that has fans to circulate air around food.	https://ddwiki.reso.org/display/DDW17/Convection+Oven
RESO::Appliance	Cooktop	Cooktop	A kitchen stove, often called simply a stove or a cooker, is a kitchen appliance designed for the purpose of cooking food. Kitchen stoves rely on the application of direct heat for the cooking process.	https://ddwiki.reso.org/display/DDW17/Cooktop
RESO::Appliance	Dishwasher	Dishwasher	A dishwasher is a mechanical device for cleaning dishware and cutlery.	https://ddwiki.reso.org/display/DDW17/Dishwasher
RESO::Appliance	Disposal	Disposal	A garbage disposal unit (also known as a garbage disposal, waste disposal unit, garbage disposer, or in Canadian English a garburator) is a device, usually electrically powered, installed under a kitchen sink between the sink's drain and the trap. The disposal unit shreds food waste into pieces small enough, generally less than 2 mm (0.079 in), to pass through plumbing.	https://ddwiki.reso.org/display/DDW17/Disposal
RESO::Appliance	DoubleOven	Double Oven	A built-in oven fixture that has either two ovens, or one oven and one microwave oven. It is usually built into the kitchen cabinet.	https://ddwiki.reso.org/display/DDW17/Double+Oven
RESO::Appliance	DownDraft	Down Draft	A vent that is part of the surface of a cook top that has a fan which sucks cooking fumes/smoke down.  This is an alternative to a hooded cooktop/range.	https://ddwiki.reso.org/display/DDW17/Down+Draft
RESO::Appliance	Dryer	Dryer	A cloths dryer.	https://ddwiki.reso.org/display/DDW17/Dryer
RESO::Appliance	ElectricCooktop	Electric Cooktop	A cooktop or stove that produces heat by way of electricity rather than gas.  An induction cooktop is electric, but not all electric cooktops are induction.	https://ddwiki.reso.org/display/DDW17/Electric+Cooktop
RESO::Appliance	ElectricOven	Electric Oven	An oven that is heated by electricity, typically by way of heating coils.	https://ddwiki.reso.org/display/DDW17/Electric+Oven
RESO::Appliance	ElectricRange	Electric Range	An oven and cooktop that generates heat by way of electricity.	https://ddwiki.reso.org/display/DDW17/Electric+Range
RESO::Appliance	ElectricWaterHeater	Electric Water Heater	A water heater that heats the water by way of electricity.	https://ddwiki.reso.org/display/DDW17/Electric+Water+Heater
RESO::Appliance	EnergyStarQualifiedAppliances	ENERGY STAR Qualified Appliances	The property includes Energy Star qualified appliances.	https://ddwiki.reso.org/display/DDW17/ENERGY+STAR+Qualified+Appliances
RESO::Appliance	EnergyStarQualifiedDishwasher	ENERGY STAR Qualified Dishwasher	The property includes an Energy Star qualified dishwasher.	https://ddwiki.reso.org/display/DDW17/ENERGY+STAR+Qualified+Dishwasher
RESO::Appliance	EnergyStarQualifiedDryer	ENERGY STAR Qualified Dryer	The property includes an Energy Star qualified cloths dryer.	https://ddwiki.reso.org/display/DDW17/ENERGY+STAR+Qualified+Dryer
RESO::Appliance	EnergyStarQualifiedFreezer	ENERGY STAR Qualified Freezer	The property includes an Energy Star qualified freezer.	https://ddwiki.reso.org/display/DDW17/ENERGY+STAR+Qualified+Freezer
RESO::Appliance	EnergyStarQualifiedRefrigerator	ENERGY STAR Qualified Refrigerator	The property includes an Energy Star qualified refrigerator.	https://ddwiki.reso.org/display/DDW17/ENERGY+STAR+Qualified+Refrigerator
RESO::Appliance	EnergyStarQualifiedWasher	ENERGY STAR Qualified Washer	The property includes an Energy Star qualified cloths washer.	https://ddwiki.reso.org/display/DDW17/ENERGY+STAR+Qualified+Washer
RESO::Appliance	EnergyStarQualifiedWaterHeater	ENERGY STAR Qualified Water Heater	The property includes an Energy Star qualified water heater.	https://ddwiki.reso.org/display/DDW17/ENERGY+STAR+Qualified+Water+Heater
RESO::Appliance	ExhaustFan	Exhaust Fan	The cooktop has an exhaust fan.	https://ddwiki.reso.org/display/DDW17/Exhaust+Fan
RESO::Appliance	FreeStandingElectricOven	Free-Standing Electric Oven	The oven is free standing, not built-in, and uses electricity to produce heat.	https://ddwiki.reso.org/display/DDW17/Free-Standing+Electric+Oven
RESO::Appliance	FreeStandingElectricRange	Free-Standing Electric Range	The range is free standing, not built-in, and uses electricity to produce heat for its oven and cooktop.	https://ddwiki.reso.org/display/DDW17/Free-Standing+Electric+Range
RESO::Appliance	FreeStandingFreezer	Free-Standing Freezer	The freezer is free standing and not built-in.	https://ddwiki.reso.org/display/DDW17/Free-Standing+Freezer
RESO::Appliance	FreeStandingGasOven	Free-Standing Gas Oven	The oven is free standing, not built-in, and uses gas to produce heat.	https://ddwiki.reso.org/display/DDW17/Free-Standing+Gas+Oven
RESO::Appliance	FreeStandingGasRange	Free-Standing Gas Range	The range is free standing, not built-in, and uses gas to produce heat for its oven and cooktop.	https://ddwiki.reso.org/display/DDW17/Free-Standing+Gas+Range
RESO::Appliance	FreeStandingRange	Free-Standing Range	The range is free standing, not built-in.	https://ddwiki.reso.org/display/DDW17/Free-Standing+Range
RESO::Appliance	FreeStandingRefrigerator	Free-Standing Refrigerator	The refrigerator is free-standing, not built-in.	https://ddwiki.reso.org/display/DDW17/Free-Standing+Refrigerator
RESO::Appliance	Freezer	Freezer	The property includes a freezer.	https://ddwiki.reso.org/display/DDW17/Freezer
RESO::Appliance	GasCooktop	Gas Cooktop	A cooktop or stove that produces heat by way of gas rather than electricity.  An induction cooktop is electric, but not all electric cooktops are induction.	https://ddwiki.reso.org/display/DDW17/Gas+Cooktop
RESO::Appliance	GasOven	Gas Oven	An oven that is heated by gas.	https://ddwiki.reso.org/display/DDW17/Gas+Oven
RESO::Appliance	GasRange	Gas Range	An oven and cooktop that generates heat by way of gas.	https://ddwiki.reso.org/display/DDW17/Gas+Range
RESO::Appliance	GasWaterHeater	Gas Water Heater	A water heater that heats the water with gas.	https://ddwiki.reso.org/display/DDW17/Gas+Water+Heater
RESO::Appliance	Humidifier	Humidifier	The property includes a humidity control device or system.	https://ddwiki.reso.org/display/DDW17/Humidifier
RESO::Appliance	IceMaker	Ice Maker	The property includes an ice maker.	https://ddwiki.reso.org/display/DDW17/Ice+Maker
RESO::Appliance	IndoorGrill	Indoor Grill	The property has an indoor grill.	https://ddwiki.reso.org/display/DDW17/Indoor+Grill
RESO::Appliance	InductionCooktop	Induction Cooktop	The electric cooktop is based on magnetic induction rather than heating coils.	https://ddwiki.reso.org/display/DDW17/Induction+Cooktop
RESO::Appliance	InstantHotWater	Instant Hot Water	The property has a circulatory or instant hot water system.	https://ddwiki.reso.org/display/DDW17/Instant+Hot+Water
RESO::Appliance	Microwave	Microwave	The property includes a microwave.	https://ddwiki.reso.org/display/DDW17/Microwave
RESO::Appliance	None	None	The property includes no appliances.	https://ddwiki.reso.org/pages/viewpage.action?pageId=29243734
RESO::Appliance	Other	Other	The property includes appliances other than those available in this list.	https://ddwiki.reso.org/pages/viewpage.action?pageId=29243735
RESO::Appliance	Oven	Oven	The property includes an oven.	https://ddwiki.reso.org/display/DDW17/Oven
RESO::Appliance	PlumbedForIceMaker	Plumbed For Ice Maker	The property has plumbing for an ice maker.	https://ddwiki.reso.org/display/DDW17/Plumbed+For+Ice+Maker
RESO::Appliance	PortableDishwasher	Portable Dishwasher	The property includes a portable dishwasher.	https://ddwiki.reso.org/display/DDW17/Portable+Dishwasher
RESO::Appliance	PropaneCooktop	Propane Cooktop	The gas cooktop uses propane as its fuel and either has a local tank or runs on a house wide propane system.	https://ddwiki.reso.org/display/DDW17/Propane+Cooktop
RESO::Appliance	Range	Range	The property includes a range, which is a single unit that has both an oven and a cooktop.	https://ddwiki.reso.org/display/DDW17/Range
RESO::Appliance	RangeHood	Range Hood	The range has a hooded exhaust.	https://ddwiki.reso.org/display/DDW17/Range+Hood
RESO::Appliance	Refrigerator	Refrigerator	The property includes a refrigerator.	https://ddwiki.reso.org/display/DDW17/Refrigerator
RESO::Appliance	SelfCleaningOven	Self Cleaning Oven	The oven included with the property has a self-cleaning feature.	https://ddwiki.reso.org/display/DDW17/Self+Cleaning+Oven
RESO::Appliance	SolarHotWater	Solar Hot Water	The hot water heater has either a passive or active solar component.	https://ddwiki.reso.org/display/DDW17/Solar+Hot+Water
RESO::Appliance	StainlessSteelAppliances	Stainless Steel Appliance(s)	Some or all of the appliances included in the property are stainless steal.	https://ddwiki.reso.org/pages/viewpage.action?pageId=29243745
RESO::Appliance	TanklessWaterHeater	Tankless Water Heater	A tankless water heater is included with the property.	https://ddwiki.reso.org/display/DDW17/Tankless+Water+Heater
RESO::Appliance	TrashCompactor	Trash Compactor	The property has a trash compactor.	https://ddwiki.reso.org/display/DDW17/Trash+Compactor
RESO::Appliance	VentedExhaustFan	Vented Exhaust Fan	The cooktop has an exhaust fan that is vented.	https://ddwiki.reso.org/display/DDW17/Vented+Exhaust+Fan
RESO::Appliance	WarmingDrawer	Warming Drawer	The property has a warming drawer.	https://ddwiki.reso.org/display/DDW17/Warming+Drawer
RESO::Appliance	Washer	Washer	The property includes a cloths washer.	https://ddwiki.reso.org/display/DDW17/Washer
RESO::Appliance	WasherDryer	Washer/Dryer	The property includes a cloths washer and dryer.	https://ddwiki.reso.org/pages/viewpage.action?pageId=29243751
RESO::Appliance	WasherDryerStacked	Washer/Dryer Stacked	The property has a stacked cloths washer and dryer.	https://ddwiki.reso.org/pages/viewpage.action?pageId=29243752
RESO::Appliance	WaterHeater	Water Heater	The property has a water heater.	https://ddwiki.reso.org/pages/viewpage.action?pageId=29243753
RESO::Appliance	WaterPurifier	Water Purifier	The property has a water purifier.	https://ddwiki.reso.org/display/DDW17/Water+Purifier
RESO::Appliance	WaterPurifierOwned	Water Purifier Owned	The property has a water purifier that is owned and not rented/leased.	https://ddwiki.reso.org/display/DDW17/Water+Purifier+Owned
RESO::Appliance	WaterPurifierRented	Water Purifier Rented	The property has a water purifier that is on a rental or lease agreement.	https://ddwiki.reso.org/display/DDW17/Water+Purifier+Rented
RESO::Appliance	WaterSoftener	Water Softener	The property has a water softening system.	https://ddwiki.reso.org/display/DDW17/Water+Softener
RESO::Appliance	WaterSoftenerOwned	Water Softener Owned	The property has a water softening system that is owned and not rented/leased.	https://ddwiki.reso.org/display/DDW17/Water+Softener+Owned
RESO::Appliance	WaterSoftenerRented	Water Softener Rented	The property has a water softening system that is on a rental or lease agreement.	https://ddwiki.reso.org/display/DDW17/Water+Softener+Rented
RESO::Appliance	WineCooler	Wine Cooler	The property includes a wine cooler.	https://ddwiki.reso.org/display/DDW17/Wine+Cooler
