type	value	display_name	definition	wiki_url
RESO::NotedBy	Agent	Agent	The agent has written the given note about the given listing.	https://ddwiki.reso.org/pages/viewpage.action?pageId=29246727
RESO::NotedBy	Contact	Contact	The contact has written the given note about the given listing.	https://ddwiki.reso.org/display/DDW17/Contact
RESO::ObjectIdType	Listingid	ListingId	The ObjectID is the MLS listing number	https://ddwiki.reso.org/pages/viewpage.action?pageId=29245795
RESO::ObjectIdType	Listingkey	ListingKey	The Object is a key field from an MLS system.	https://ddwiki.reso.org/pages/viewpage.action?pageId=29245796
RESO::ObjectIdType	Listingkeynumeric	ListingKeyNumeric	The Object is a numeric key field from an MLS system.	https://ddwiki.reso.org/pages/viewpage.action?pageId=29245797
RESO::ObjectIdType	Openhouseid	OpenHouseId	The ObjectID is an Open House ID	https://ddwiki.reso.org/pages/viewpage.action?pageId=29245798
RESO::ObjectIdType	Openhousekey	OpenHouseKey	The ObjectID is the key of an Open House record.	https://ddwiki.reso.org/pages/viewpage.action?pageId=29245799
RESO::ObjectIdType	Openhousekeynumeric	OpenHouseKeyNumeric	The ObjectID is the numeric only key of an Open House record.	https://ddwiki.reso.org/pages/viewpage.action?pageId=29245800
RESO::ObjectIdType	Parcelnumber	ParcelNumber	When no listing exists or the tracking is property centric, the ObjectIdType of the property's Parcel Number is used.	https://ddwiki.reso.org/pages/viewpage.action?pageId=29245801
RESO::ObjectIdType	Puid	PUID	When no listing exists and the tracking property centric, the RESO PUID is being used.	https://ddwiki.reso.org/display/DDW17/PUID
RESO::ObjectIdType	Savedsearchkey	SavedSearchKey	When the event is the execution of a saved search, the ObjectID will be the SavedSearchKey or SavedSearchKeyNumeric from the system that executed the search. Individual listings from the result set or being viewed would be separate events for each record.	https://ddwiki.reso.org/pages/viewpage.action?pageId=29245803
RESO::ObjectIdType	Savedsearchkeynumeric	SavedSearchKeyNumeric	When the event is the execution of a saved search, the ObjectID will be the SavedSearchKey or SavedSearchKeyNumeric from the system that executed the search. Individual listings from the result set or being viewed would be separate events for each record.	https://ddwiki.reso.org/pages/viewpage.action?pageId=29245804
RESO::ObjectIdType	Unique	Unique	The ObjectID is a unique ID supplied by the source and is not one of the other types…	https://ddwiki.reso.org/display/DDW17/Unique
RESO::ObjectType	Document	Document	The Object of the tracking event is a Document.	https://ddwiki.reso.org/pages/viewpage.action?pageId=29245812
RESO::ObjectType	Listing	Listing	The object of the tracking event is a real estate listing	https://ddwiki.reso.org/display/DDW17/Listing
RESO::ObjectType	OpenHouse	Open House	The object of the tracking event is an Open House event	https://ddwiki.reso.org/pages/viewpage.action?pageId=29245808
RESO::ObjectType	Photo	Photo	The Object of the tracking event is a Photo.	https://ddwiki.reso.org/pages/viewpage.action?pageId=29245811
RESO::ObjectType	Property	Property	When no listing exists or the tracking is property centric, the ObjectType of Property is used.	https://ddwiki.reso.org/pages/viewpage.action?pageId=29245809
RESO::ObjectType	SavedSearch	Saved Search	When the event is the execution of a saved search, the Object will be a Saved Search from the system that executed the search. If tracked, individual listings from the result set or being viewed would be separate events for each record.	https://ddwiki.reso.org/pages/viewpage.action?pageId=29245810
RESO::ObjectType	VirtualTour	Virtual Tour	The Object of the tracking event is considered a Virtual Tour.	https://ddwiki.reso.org/pages/viewpage.action?pageId=29245813
RESO::OccupantType	Owner	Owner	The occupant is the owner.	https://ddwiki.reso.org/pages/viewpage.action?pageId=29245646
RESO::OccupantType	Tenant	Tenant	The occupant is a tenant.	https://ddwiki.reso.org/display/DDW17/Tenant
RESO::OccupantType	Vacant	Vacant	The property is vacant.	https://ddwiki.reso.org/display/DDW17/Vacant
RESO::OfficeBranchType	Branch	Branch	This office is a branch office.	https://ddwiki.reso.org/display/DDW17/Branch
RESO::OfficeBranchType	Main	Main	This office is the broker's main office.	https://ddwiki.reso.org/display/DDW17/Main
RESO::OfficeBranchType	StandAlone	Stand Alone	This office is a stand alone, or single office brokerage.	https://ddwiki.reso.org/display/DDW17/Stand+Alone
RESO::OfficeStatus	Active	Active	The member office's account is active.	https://ddwiki.reso.org/pages/viewpage.action?pageId=29245650
RESO::OfficeStatus	Inactive	Inactive	The member office's account is not active.	https://ddwiki.reso.org/pages/viewpage.action?pageId=29245651
RESO::OfficeType	Affiliate	Affiliate	The record in the office roster is an affiliate office.	https://ddwiki.reso.org/display/DDW17/Affiliate
RESO::OfficeType	Appraiser	Appraiser	The record in the office roster is an appraiser office.	https://ddwiki.reso.org/pages/viewpage.action?pageId=29245654
RESO::OfficeType	Association	Association	The record in the office roster is an association office.	https://ddwiki.reso.org/display/DDW17/Association
RESO::OfficeType	Mls	MLS	The record in the office roster is an MLS office.	https://ddwiki.reso.org/display/DDW17/MLS
RESO::OfficeType	MlsOnlyBranch	MLS Only Branch	The record in the office roster is a broker branch office who receives only MLS service.	https://ddwiki.reso.org/display/DDW17/MLS+Only+Branch
RESO::OfficeType	MlsOnlyFirm	MLS Only Firm	The record in the office roster is a broker Firm office who receives only MLS service.	https://ddwiki.reso.org/display/DDW17/MLS+Only+Firm
RESO::OfficeType	MlsOnlyOffice	MLS Only Office	The record in the office roster is a broker office who receives only MLS service.	https://ddwiki.reso.org/display/DDW17/MLS+Only+Office
RESO::OfficeType	NonMemberVendor	Non Member/Vendor	The record in the office roster is an non member/vendor office.	https://ddwiki.reso.org/pages/viewpage.action?pageId=29245660
RESO::OfficeType	RealtorBranchOffice	Realtor Branch Office	The record in the office roster is an realtor branch office .	https://ddwiki.reso.org/display/DDW17/Realtor+Branch+Office
RESO::OfficeType	RealtorFirm	Realtor Firm	The record in the office roster is an realtor firm office.	https://ddwiki.reso.org/display/DDW17/Realtor+Firm
RESO::OfficeType	RealtorOffice	Realtor Office	The record in the office roster is an realtor office.	https://ddwiki.reso.org/display/DDW17/Realtor+Office
RESO::OpenHouseStatus	Active	Active	The open house is active and continuing as scheduled.	https://ddwiki.reso.org/pages/viewpage.action?pageId=29245665
RESO::OpenHouseStatus	Canceled	Canceled	The open house has been canceled.	https://ddwiki.reso.org/pages/viewpage.action?pageId=29245666
RESO::OpenHouseStatus	Ended	Ended	The open house has ended and is past the scheduled open house date and time.	https://ddwiki.reso.org/display/DDW17/Ended
RESO::OpenHouseType	Broker	Broker	The open house is only open to brokers, and at times agents.	https://ddwiki.reso.org/display/DDW17/Broker
RESO::OpenHouseType	Office	Office	The open house is only open to the members of a particular office(s).	https://ddwiki.reso.org/pages/viewpage.action?pageId=29245670
RESO::OpenHouseType	Public	Public	The open house is open to the general public.	https://ddwiki.reso.org/display/DDW17/Public
RESO::OperatingExpenseIncludes	Accounting	Accounting	The operating expense amount includes accounting costs.	https://ddwiki.reso.org/pages/viewpage.action?pageId=29245673
RESO::OperatingExpenseIncludes	Advertising	Advertising	The operating expense amount includes advertising costs.	https://ddwiki.reso.org/pages/viewpage.action?pageId=29245674
RESO::OperatingExpenseIncludes	Association	Association	The operating expense amount includes association costs.	https://ddwiki.reso.org/pages/viewpage.action?pageId=29245675
RESO::OperatingExpenseIncludes	CableTv	Cable TV	The operating expense amount includes cable TV costs.	https://ddwiki.reso.org/pages/viewpage.action?pageId=29245676
RESO::OperatingExpenseIncludes	CapitalImprovements	Capital Improvements	The operating expense amount includes capital improvements costs.	https://ddwiki.reso.org/display/DDW17/Capital+Improvements
RESO::OperatingExpenseIncludes	Depreciation	Depreciation	The operating expense amount includes depreciation costs.	https://ddwiki.reso.org/display/DDW17/Depreciation
RESO::OperatingExpenseIncludes	EquipmentRental	Equipment Rental	The operating expense amount includes equipment rental costs.	https://ddwiki.reso.org/display/DDW17/Equipment+Rental
RESO::OperatingExpenseIncludes	Fuel	Fuel	The operating expense amount includes fuel costs.	https://ddwiki.reso.org/display/DDW17/Fuel
RESO::OperatingExpenseIncludes	FurnitureReplacement	Furniture Replacement	The operating expense amount includes furniture replacement costs.	https://ddwiki.reso.org/display/DDW17/Furniture+Replacement
RESO::OperatingExpenseIncludes	Gardener	Gardener	The operating expense amount includes gardener costs.	https://ddwiki.reso.org/display/DDW17/Gardener
RESO::OperatingExpenseIncludes	Insurance	Insurance	The operating expense amount includes insurance costs.	https://ddwiki.reso.org/pages/viewpage.action?pageId=29245683
RESO::OperatingExpenseIncludes	Legal	Legal	The operating expense amount includes legal costs.	https://ddwiki.reso.org/display/DDW17/Legal
RESO::OperatingExpenseIncludes	Licenses	Licenses	The operating expense amount includes licenses costs.	https://ddwiki.reso.org/display/DDW17/Licenses
RESO::OperatingExpenseIncludes	Maintenance	Maintenance	The operating expense amount includes maintenance costs.	https://ddwiki.reso.org/display/DDW17/Maintenance
RESO::OperatingExpenseIncludes	MaintenanceGrounds	Maintenance Grounds	The operating expense amount includes maintenance grounds costs.	https://ddwiki.reso.org/pages/viewpage.action?pageId=29245687
RESO::OperatingExpenseIncludes	MaintenanceStructure	Maintenance Structure	The operating expense amount includes maintenance structure costs.	https://ddwiki.reso.org/display/DDW17/Maintenance+Structure
RESO::OperatingExpenseIncludes	Manager	Manager	The operating expense amount includes manager costs.	https://ddwiki.reso.org/display/DDW17/Manager
RESO::OperatingExpenseIncludes	MortgageLoans	Mortgage/Loans	The operating expense amount includes mortgage/loans costs.	https://ddwiki.reso.org/pages/viewpage.action?pageId=29245690
RESO::OperatingExpenseIncludes	NewTax	New Tax	The operating expense amount includes new tax costs.	https://ddwiki.reso.org/display/DDW17/New+Tax
RESO::OperatingExpenseIncludes	Other	Other	The operating expense amount includes other costs.	https://ddwiki.reso.org/pages/viewpage.action?pageId=29245692
RESO::OperatingExpenseIncludes	Parking	Parking	The operating expense amount includes parking costs.	https://ddwiki.reso.org/pages/viewpage.action?pageId=29245693
RESO::OperatingExpenseIncludes	PestControl	Pest Control	The operating expense amount includes pest control costs.	https://ddwiki.reso.org/pages/viewpage.action?pageId=29245694
RESO::OperatingExpenseIncludes	PoolSpa	Pool/Spa	The operating expense amount includes pool/spa costs.	https://ddwiki.reso.org/pages/viewpage.action?pageId=29245695
RESO::OperatingExpenseIncludes	ProfessionalManagement	Professional Management	The operating expense amount includes professional management costs.	https://ddwiki.reso.org/display/DDW17/Professional+Management
RESO::OperatingExpenseIncludes	Security	Security	The operating expense amount includes security costs.	https://ddwiki.reso.org/pages/viewpage.action?pageId=29245697
RESO::OperatingExpenseIncludes	SnowRemoval	Snow Removal	The operating expense amount includes snow removal costs.	https://ddwiki.reso.org/pages/viewpage.action?pageId=29245698
RESO::OperatingExpenseIncludes	Staff	Staff	The operating expense amount includes staff costs.	https://ddwiki.reso.org/display/DDW17/Staff
RESO::OperatingExpenseIncludes	Supplies	Supplies	The operating expense amount includes supplies costs.	https://ddwiki.reso.org/display/DDW17/Supplies
RESO::OperatingExpenseIncludes	Trash	Trash	The operating expense amount includes trash costs.	https://ddwiki.reso.org/pages/viewpage.action?pageId=29245701
RESO::OperatingExpenseIncludes	Utilities	Utilities	The operating expense amount includes utilities costs.	https://ddwiki.reso.org/pages/viewpage.action?pageId=29245702
RESO::OperatingExpenseIncludes	VacancyAllowance	Vacancy Allowance	The operating expense amount includes vacancy allowance costs.	https://ddwiki.reso.org/display/DDW17/Vacancy+Allowance
RESO::OperatingExpenseIncludes	WaterSewer	Water/Sewer	The operating expense amount includes water/sewer costs.	https://ddwiki.reso.org/pages/viewpage.action?pageId=29245704
RESO::OperatingExpenseIncludes	WorkmansCompensation	Workmans Compensation	The operating expense amount includes workman's compensation costs.	https://ddwiki.reso.org/display/DDW17/Workmans+Compensation
RESO::OtherEquipment	AirPurifier	Air Purifier	The property includes an air purifier.	https://ddwiki.reso.org/display/DDW17/Air+Purifier
RESO::OtherEquipment	CallListingAgent	Call Listing Agent	Call the listing agent for more information about other equipment included with the property.	https://ddwiki.reso.org/pages/viewpage.action?pageId=29245816
RESO::OtherEquipment	Compressor	Compressor	The property includes a compressor.	https://ddwiki.reso.org/display/DDW17/Compressor
RESO::OtherEquipment	DcWellPump	DC Well Pump	The property includes a DC well pump.	https://ddwiki.reso.org/display/DDW17/DC+Well+Pump
RESO::OtherEquipment	Dehumidifier	Dehumidifier	The property includes a dehumidifier.	https://ddwiki.reso.org/display/DDW17/Dehumidifier
RESO::OtherEquipment	FarmEquipment	Farm Equipment	The property includes farm equipment.	https://ddwiki.reso.org/display/DDW17/Farm+Equipment
RESO::OtherEquipment	FuelTanks	Fuel Tank(s)	The property includes a fuel tank(s).	https://ddwiki.reso.org/pages/viewpage.action?pageId=29245821
RESO::OtherEquipment	Generator	Generator	The property includes a generator.	https://ddwiki.reso.org/pages/viewpage.action?pageId=29245822
RESO::OtherEquipment	HomeTheater	Home Theater	The property includes a home theater.	https://ddwiki.reso.org/display/DDW17/Home+Theater
RESO::OtherEquipment	Intercom	Intercom	The property includes an intercom.	https://ddwiki.reso.org/display/DDW17/Intercom
RESO::OtherEquipment	IrrigationEquipment	Irrigation Equipment	The property includes irrigation equipment.	https://ddwiki.reso.org/display/DDW17/Irrigation+Equipment
RESO::OtherEquipment	ListAvailable	List Available	A list of other equipment included with the property is available upon request.	https://ddwiki.reso.org/display/DDW17/List+Available
RESO::OtherEquipment	LivestockEquipment	Livestock Equipment	The property includes livestock equipment.	https://ddwiki.reso.org/display/DDW17/Livestock+Equipment
RESO::OtherEquipment	Negotiable	Negotiable	The other equipment included with the property is negotiable.	https://ddwiki.reso.org/pages/viewpage.action?pageId=29245828
RESO::OtherEquipment	None	None	There is no other equipment included with the property.	https://ddwiki.reso.org/pages/viewpage.action?pageId=29245829
RESO::OtherEquipment	OrchardEquipment	Orchard Equipment	The property includes orchard equipment.	https://ddwiki.reso.org/display/DDW17/Orchard+Equipment
RESO::OtherEquipment	Other	Other	The property includes equipment other than what's included in this list.	https://ddwiki.reso.org/pages/viewpage.action?pageId=29245831
RESO::OtherEquipment	RotaryAntenna	Rotary Antenna	The property includes a rotary antenna.	https://ddwiki.reso.org/display/DDW17/Rotary+Antenna
RESO::OtherEquipment	SatelliteDish	Satellite Dish	The property includes a satellite dish.	https://ddwiki.reso.org/display/DDW17/Satellite+Dish
RESO::OtherEquipment	TvAntenna	TV Antenna	The property includes a TV antenna.	https://ddwiki.reso.org/display/DDW17/TV+Antenna
RESO::OtherEquipment	VariesByUnit	Varies by Unit	The equipment included with the property varies from unit to unit.	https://ddwiki.reso.org/pages/viewpage.action?pageId=29245835
RESO::OtherPhoneType	Direct	Direct	This is the contact's direct number.	https://ddwiki.reso.org/pages/viewpage.action?pageId=29245746
RESO::OtherPhoneType	Fax	Fax	This is the contact's fax.	https://ddwiki.reso.org/pages/viewpage.action?pageId=29245747
RESO::OtherPhoneType	First	First	This is the contact's first preferred phone.	https://ddwiki.reso.org/pages/viewpage.action?pageId=29245748
RESO::OtherPhoneType	Home	Home	This is the contact's home phone.	https://ddwiki.reso.org/pages/viewpage.action?pageId=29245749
RESO::OtherPhoneType	Mobile	Mobile	This is the contact's mobile phone.	https://ddwiki.reso.org/pages/viewpage.action?pageId=29245750
RESO::OtherPhoneType	Modem	Modem	This is the contact's modem.	https://ddwiki.reso.org/pages/viewpage.action?pageId=29245751
RESO::OtherPhoneType	Office	Office	This is the contact's office phone.	https://ddwiki.reso.org/pages/viewpage.action?pageId=29245752
RESO::OtherPhoneType	Pager	Pager	This is the contact's pager.	https://ddwiki.reso.org/pages/viewpage.action?pageId=29245753
RESO::OtherPhoneType	Preferred	Preferred	This is the contact's preferred phone.	https://ddwiki.reso.org/pages/viewpage.action?pageId=29245754
RESO::OtherPhoneType	Second	Second	This is the contact's second preferred phone.	https://ddwiki.reso.org/pages/viewpage.action?pageId=29245755
RESO::OtherPhoneType	Sms	SMS	This is the contact's SMS/text number.	https://ddwiki.reso.org/pages/viewpage.action?pageId=29245756
RESO::OtherPhoneType	Third	Third	This is the contact's third preferred phone.	https://ddwiki.reso.org/pages/viewpage.action?pageId=29245757
RESO::OtherPhoneType	TollFree	Toll Free	This is the contact's toll free number.	https://ddwiki.reso.org/pages/viewpage.action?pageId=29245758
RESO::OtherPhoneType	Voicemail	Voicemail	This is the contact's voicemail.	https://ddwiki.reso.org/pages/viewpage.action?pageId=29245759
RESO::OtherStructure	AirplaneHangar	Airplane Hangar	The property includes an airplane hangar.	https://ddwiki.reso.org/display/DDW17/Airplane+Hangar
RESO::OtherStructure	Arena	Arena	The property includes an arena.	https://ddwiki.reso.org/display/DDW17/Arena
RESO::OtherStructure	Barns	Barn(s)	The property includes a barn(s).	https://ddwiki.reso.org/pages/viewpage.action?pageId=29245763
RESO::OtherStructure	BoatHouse	Boat House	The property includes a boat house.	https://ddwiki.reso.org/display/DDW17/Boat+House
RESO::OtherStructure	Cabana	Cabana	The property includes a cabana.	https://ddwiki.reso.org/display/DDW17/Cabana
RESO::OtherStructure	Caves	Cave(s)	The property includes a cave(s).	https://ddwiki.reso.org/pages/viewpage.action?pageId=29245766
RESO::OtherStructure	Corrals	Corral(s)	The property includes a corral(s).	https://ddwiki.reso.org/pages/viewpage.action?pageId=29245767
RESO::OtherStructure	CoveredArena	Covered Arena	The property includes a covered arena.	https://ddwiki.reso.org/display/DDW17/Covered+Arena
RESO::OtherStructure	Garages	Garage(s)	The property includes a garage(s).	https://ddwiki.reso.org/pages/viewpage.action?pageId=29245769
RESO::OtherStructure	Gazebo	Gazebo	The property includes a gazebo.	https://ddwiki.reso.org/display/DDW17/Gazebo
RESO::OtherStructure	GrainStorage	Grain Storage	The property includes grain storage.	https://ddwiki.reso.org/display/DDW17/Grain+Storage
RESO::OtherStructure	Greenhouse	Greenhouse	The property includes a greenhouse.	https://ddwiki.reso.org/display/DDW17/Greenhouse
RESO::OtherStructure	GuestHouse	Guest House	The property includes a guest house.	https://ddwiki.reso.org/display/DDW17/Guest+House
RESO::OtherStructure	KennelDogRun	Kennel/Dog Run	The property includes a kennel or dog run.	https://ddwiki.reso.org/pages/viewpage.action?pageId=29245774
RESO::OtherStructure	MobileHome	Mobile Home	The property includes a mobile home.	https://ddwiki.reso.org/pages/viewpage.action?pageId=29245775
RESO::OtherStructure	None	None	The property has no other structures.	https://ddwiki.reso.org/pages/viewpage.action?pageId=29245776
RESO::OtherStructure	Other	Other	The property includes a structure other than those included in this list.	https://ddwiki.reso.org/pages/viewpage.action?pageId=29245777
RESO::OtherStructure	Outbuilding	Outbuilding	The property includes an outbuilding.	https://ddwiki.reso.org/display/DDW17/Outbuilding
RESO::OtherStructure	OutdoorKitchen	Outdoor Kitchen	The property includes an outdoor kitchen.	https://ddwiki.reso.org/display/DDW17/Outdoor+Kitchen
RESO::OtherStructure	PackingShed	Packing Shed	The property includes a packing shed.	https://ddwiki.reso.org/display/DDW17/Packing+Shed
RESO::OtherStructure	Pergola	Pergola	The property includes a pergola.	https://ddwiki.reso.org/display/DDW17/Pergola
RESO::OtherStructure	PoolHouse	Pool House	The property includes a pool house.	https://ddwiki.reso.org/display/DDW17/Pool+House
RESO::OtherStructure	PoultryCoop	Poultry Coop	The property includes a poultry coop.	https://ddwiki.reso.org/display/DDW17/Poultry+Coop
RESO::OtherStructure	Residence	Residence	The property includes a residence structure.	https://ddwiki.reso.org/display/DDW17/Residence
RESO::OtherStructure	RvBoatStorage	RV/Boat Storage	The property includes RV or boat storage.	https://ddwiki.reso.org/pages/viewpage.action?pageId=29245785
RESO::OtherStructure	SecondGarage	Second Garage	The property includes a second garage.	https://ddwiki.reso.org/display/DDW17/Second+Garage
RESO::OtherStructure	SecondResidence	Second Residence	The property includes a second residence.	https://ddwiki.reso.org/display/DDW17/Second+Residence
RESO::OtherStructure	SeeRemarks	See Remarks	See the Public or Private Remarks for information about other structures on the property.	https://ddwiki.reso.org/pages/viewpage.action?pageId=29245788
RESO::OtherStructure	Sheds	Shed(s)	The property includes a shed(s).	https://ddwiki.reso.org/pages/viewpage.action?pageId=29245789
RESO::OtherStructure	Stables	Stable(s)	The property includes stable(s).	https://ddwiki.reso.org/pages/viewpage.action?pageId=29245790
RESO::OtherStructure	Storage	Storage	The property includes storage.	https://ddwiki.reso.org/pages/viewpage.action?pageId=29245791
RESO::OtherStructure	TennisCourts	Tennis Court(s)	The property includes a tennis court(s).	https://ddwiki.reso.org/pages/viewpage.action?pageId=29245792
RESO::OtherStructure	Workshop	Workshop	The property includes a workshop.	https://ddwiki.reso.org/pages/viewpage.action?pageId=29245793
RESO::OwnerPays	AllUtilities	All Utilities	The owner/lessor pays for all utilities.	https://ddwiki.reso.org/display/DDW17/All+Utilities
RESO::OwnerPays	AssociationFees	Association Fees	The owner/lessor pays for association fees.	https://ddwiki.reso.org/display/DDW17/Association+Fees
RESO::OwnerPays	CableTv	Cable TV	The owner/lessor pays for cable television.	https://ddwiki.reso.org/pages/viewpage.action?pageId=29245709
RESO::OwnerPays	CommonAreaMaintenance	Common Area Maintenance	The owner/lessor pays for common area maintenance.	https://ddwiki.reso.org/display/DDW17/Common+Area+Maintenance
RESO::OwnerPays	Electricity	Electricity	The owner/lessor pays for electricity.	https://ddwiki.reso.org/pages/viewpage.action?pageId=29245711
RESO::OwnerPays	ExteriorMaintenance	Exterior Maintenance	The owner/lessor pays for exterior maintenance.	https://ddwiki.reso.org/display/DDW17/Exterior+Maintenance
RESO::OwnerPays	Gas	Gas	The owner/lessor pays for gas.	https://ddwiki.reso.org/pages/viewpage.action?pageId=29245713
RESO::OwnerPays	GroundsCare	Grounds Care	The owner/lessor pays for grounds care.	https://ddwiki.reso.org/display/DDW17/Grounds+Care
RESO::OwnerPays	HotWater	Hot Water	The owner/lessor pays for hot water.	https://ddwiki.reso.org/display/DDW17/Hot+Water
RESO::OwnerPays	HvacMaintenance	HVAC Maintenance	The owner/lessor pays for HVAC maintenance.	https://ddwiki.reso.org/display/DDW17/HVAC+Maintenance
RESO::OwnerPays	Insurance	Insurance	The owner/lessor pays for insurance.	https://ddwiki.reso.org/pages/viewpage.action?pageId=29245717
RESO::OwnerPays	JanitorialService	Janitorial Service	The owner/lessor pays for janitorial service .	https://ddwiki.reso.org/display/DDW17/Janitorial+Service
RESO::OwnerPays	Management	Management	The owner/lessor pays for management.	https://ddwiki.reso.org/display/DDW17/Management
RESO::OwnerPays	None	None	The owner/lessor pays for no utilities, services, etc.	https://ddwiki.reso.org/pages/viewpage.action?pageId=29245720
RESO::OwnerPays	Other	Other	The owner/lessor pays for items that are not included in this list.	https://ddwiki.reso.org/pages/viewpage.action?pageId=29245721
RESO::OwnerPays	OtherTax	Other Tax	The owner/lessor pays for other taxes.	https://ddwiki.reso.org/display/DDW17/Other+Tax
RESO::OwnerPays	ParkingFee	Parking Fee	The owner/lessor pays for parking fees.	https://ddwiki.reso.org/display/DDW17/Parking+Fee
RESO::OwnerPays	PestControl	Pest Control	The owner/lessor pays for pest control.	https://ddwiki.reso.org/pages/viewpage.action?pageId=29245724
RESO::OwnerPays	PoolMaintenance	Pool Maintenance	The owner/lessor pays for pool maintenance.	https://ddwiki.reso.org/display/DDW17/Pool+Maintenance
RESO::OwnerPays	Repairs	Repairs	The owner/lessor pays for repairs.	https://ddwiki.reso.org/display/DDW17/Repairs
RESO::OwnerPays	RoofMaintenance	Roof Maintenance	The owner/lessor pays for roof maintenance.	https://ddwiki.reso.org/display/DDW17/Roof+Maintenance
RESO::OwnerPays	Security	Security	The owner/lessor pays for security.	https://ddwiki.reso.org/pages/viewpage.action?pageId=29245728
RESO::OwnerPays	SeeRemarks	See Remarks	See the listing's remarks for details on what the owner/lessor pays for.	https://ddwiki.reso.org/pages/viewpage.action?pageId=29245729
RESO::OwnerPays	Sewer	Sewer	The owner/lessor pays for sewer.	https://ddwiki.reso.org/pages/viewpage.action?pageId=29245730
